food;ingredients;category;kitchen;food_url
Рождественская ветчина с медом;свиной окорок, репчатый лук, морковь, гвоздика, яичный желток, мед, эспрессо, дижонская горчица, соль;Основные блюда;Британская кухня;https://eda.ru/recepty/osnovnye-blyuda/rozhdestvenskaya-vetchina-s-medom-47442
Картофель в духовке с яйцами и мускатным орехом;картофель, молоко, куриное яйцо, сливочное масло, мускатный орех, соль, молотый черный перец;Основные блюда;Французская кухня;https://eda.ru/recepty/osnovnye-blyuda/kartofel-v-duhovke-s-jajcami-i-muskatnim-orehom-17803
Вака-фрита;фланк-стейк , репчатый лук, зеленый сладкий перец, чеснок, молотый кумин (зира) , лайм, сахар, лавровый лист, растительное масло, соль, молотый черный перец;Основные блюда;Кубинская кухня;https://eda.ru/recepty/osnovnye-blyuda/vaka-frita-114369
Лосось под корочкой из песто, с лапшой из цукини;филе лосося, зеленый базилик , кедровые орехи, сыр пекорино, чеснок, цукини, помидоры, лимон, красный лук, сливочное масло, оливковое масло, подсолнечное масло, петрушка, соль, молотый черный перец;Основные блюда;Итальянская кухня;https://eda.ru/recepty/osnovnye-blyuda/losos-pod-korochkoj-iz-pesto-s-lapshoj-iz-cukini-33805
Овощи в духовке;мини-картофель , капуста брокколи, морковь, красный лук, цукини, желтый сладкий перец, красный сладкий перец, лимон, чеснок, итальянские травы, соль, молотый черный перец;Основные блюда;Европейская кухня;https://eda.ru/recepty/osnovnye-blyuda/ovoschi-v-duhovke-151620
Курица в бальзамической карамели;филе куриной грудки, сахар, сливочное масло, бальзамический уксус, лимонный сок, специи;Основные блюда;Итальянская кухня;https://eda.ru/recepty/osnovnye-blyuda/kurica-v-balzamicheskoj-karameli-31915
Индейка на сковороде;филе индейки, растительное масло, молотый кориандр , молотый кардамон, паприка, куркума, соль, молотый черный перец;Основные блюда;Европейская кухня;https://eda.ru/recepty/osnovnye-blyuda/indeyka-na-skovorode-151067
Брокколи в азиатском стиле с булгуром и кедровыми орехами кимчи;капуста брокколи, лук-порей, соус наршараб, мята, кинза, лайм, лимон, рыбный соус, яблочный уксус, миндаль, кленовый сироп, оливковое масло extra virgin, рафинированное оливковое масло, булгур, соус кимчи, кедровые орехи, салат корн;Основные блюда;Китайская кухня;https://eda.ru/recepty/osnovnye-blyuda/brokkoli-v-aziatskom-stile-s-bulgurom-i-kedrovymi-orehami-kimchi-93193
Чкмерули из цыпленка;цыпленок, сливки 35%-ные, чеснок, кинза, уцхо-сунели, молотый красный перец, соль;Основные блюда;Грузинская кухня;https://eda.ru/recepty/osnovnye-blyuda/chkmeruli-iz-cyplenka-152609
Куриные грудки с медом и кунжутом;куриное филе, соевый соус, мед, растительное масло, чеснок, молотый черный перец, карри, молотый имбирь;Основные блюда;Европейская кухня;https://eda.ru/recepty/osnovnye-blyuda/kurinie-grudki-s-medom-i-kunzhutom-48513
Паэлья с кроликом;рис бомба, куриные окорочка, ножки кролика, белая фасоль, зеленая стручковая фасоль, консервированные помидоры кусочками, оливковое масло, куриный бульон, чеснок, соль, паприка, шафран, репчатый лук;Основные блюда;Испанская кухня;https://eda.ru/recepty/osnovnye-blyuda/paelya-s-krolikom-125568
Гуляш по-итальянски;говядина, репчатый лук, паприка, молотый кумин (зира) , лавровый лист, лимон, чеснок, консервированные помидоры, сливочное масло, уксус, соль, мясной бульон;Основные блюда;Итальянская кухня;https://eda.ru/recepty/osnovnye-blyuda/guljash-po-italjanski-15386
Пюттипанна;картофель, шашлык, вареная курица, репчатый лук, куриное яйцо, петрушка, свекла, уксус, сахар, вода, сливочное масло, соль, молотый черный перец;Основные блюда;Шведская кухня;https://eda.ru/recepty/osnovnye-blyuda/pyuttipanna-136819
Брокколи гриль с травяным песто и миндалем;капуста брокколи, свежая мята, миндаль, соус наршараб, рыбный соус, рафинированное оливковое масло, яблочный уксус, оливковое масло extra virgin, сыр брынза, лайм, тимьян, розмарин, соль, кленовый сироп;Основные блюда;Европейская кухня;https://eda.ru/recepty/osnovnye-blyuda/brokkoli-gril-s-travyanym-pesto-i-mindalem-93190
Кролик в красном вине;ножки кролика, красное сухое вино, чеснок, петрушка, тимьян, лук, морковь, лук-шалот, пшеничная мука, жасминовый рис, растительное масло, сливочное масло, сахар, соль, молотый черный перец;Основные блюда;Европейская кухня;https://eda.ru/recepty/osnovnye-blyuda/krolik-v-krasnom-vine-26292
Запеченная кефаль;кефаль, петрушка, укроп, лимон, чеснок, репчатый лук, растительное масло, соль, молотый черный перец;Основные блюда;Европейская кухня;https://eda.ru/recepty/osnovnye-blyuda/zapechennaya-kefal-69093
Куриные грудки в духовке;куриное филе, коричневый сахар, паприка, орегано, молотый сушеный чеснок, молотый сушеный лук, молотый перец чили, оливковое масло, сливочное масло, чеснок, петрушка, соль, молотый черный перец;Основные блюда;Европейская кухня;https://eda.ru/recepty/osnovnye-blyuda/kurinye-grudki-v-duhovke-140538
Утка с яблоками;утка, молотый черный перец, яблоко, лавровый лист, корица, мускатный орех, лимонный сок, соль;Основные блюда;Русская кухня;https://eda.ru/recepty/osnovnye-blyuda/utka-s-jablokami-17295
Кролик с яблоками;ножки кролика, чеснок, яблоко, тимьян, оливковое масло, соль;Основные блюда;Европейская кухня;https://eda.ru/recepty/osnovnye-blyuda/krolik-s-jablokami-36065
Кролик, запеченный с тимьяном;тимьян, кролик, оливковое масло, лимон, чеснок, белое сухое вино, картофель, соль;Основные блюда;Французская кухня;https://eda.ru/recepty/osnovnye-blyuda/krolik-zapechennij-s-timjanom-29201
Бургеры из нута;консервированный нут, булочка с кунжутом, грецкие орехи, чеснок, репчатый лук, помидоры, белый хлеб, красный лук, куриное яйцо, оливковое масло, петрушка, соль, молотый черный перец, свежий розмарин ;Основные блюда;Американская кухня;https://eda.ru/recepty/osnovnye-blyuda/burgeri-iz-nuta-34564
Жареные курица и креветки с лапшой соба и маринованным имбирем;лапша соба, соевый соус, репчатый лук, зеленый лук, бобовые проростки , очищенные вареные креветки, свежий красный перец, куриная грудка, растительное масло, зеленый перец, куриное яйцо, лук-шалот, маринованный имбирь, кунжутные семечки;Основные блюда;Японская кухня;https://eda.ru/recepty/osnovnye-blyuda/zharenie-kurica-krevetki-s-lapshoj-soba-marinovannim-imbirem-20091
Гюцпот;говяжья грудинка, лавровый лист, листья шалфея, мускатный цвет, сливочное масло, репчатый лук, картофель, морковь, соль, молотый черный перец;Основные блюда;Голландская кухня;https://eda.ru/recepty/osnovnye-blyuda/gyucpot-137364
Запеканка с фаршем и картофелем;картофель, мясной фарш, твердый сыр, помидоры, лук, сливочное масло, соль, молотый черный перец, растительное масло;Основные блюда;Русская кухня;https://eda.ru/recepty/osnovnye-blyuda/zapekanka-s-farshem-i-kartofelem-32626
Хаггис Дмитрия Зотова;баранья жировая сетка, бараньи легкие, баранье сердце, бараньи почки, баранья печень, баранья лопатка, репчатый лук, пшено, мускатный орех, семена фенхеля, соль, молотый черный перец;Основные блюда;Шотландская кухня;https://eda.ru/recepty/osnovnye-blyuda/haggis-dmitriya-zotova-69241
Медовые свиные ребра;свиные ребра, тростниковый сахар, темный соевый соус, светлый соевый соус, коньяк, кунжутное масло, мед, соус хойсин;Основные блюда;Китайская кухня;https://eda.ru/recepty/osnovnye-blyuda/medovie-svinie-rebra-25997
Шашлык из говядины;говядина, лук, курдючное сало, молотый кориандр , кумин (зира), соль;Основные блюда;Кавказская кухня;https://eda.ru/recepty/osnovnye-blyuda/shashlik-iz-govjadini-28053
Курица с грибами в духовке;куриное филе, шампиньоны, куриный бульон, сыр моцарелла, смесь итальянских трав, соль, молотый черный перец, петрушка, растительное масло;Основные блюда;Европейская кухня;https://eda.ru/recepty/osnovnye-blyuda/kurica-s-gribami-v-duhovke-140638
Лисички, тушеные в сметане;сметана, лисички, репчатый лук, сливочное масло, соль;Основные блюда;Русская кухня;https://eda.ru/recepty/osnovnye-blyuda/lisichki-tushenie-v-smetane-32987
Жареная картошка с грибами;картофель, шампиньоны, опята, репчатый лук, растительное масло, петрушка, укроп, чеснок, молотый черный перец, соль;Основные блюда;Русская кухня;https://eda.ru/recepty/osnovnye-blyuda/zharenaya-kartoshka-s-gribami-139941
Холодец из курицы;курица, стебель сельдерея, морковь, репчатый лук, сладкий перец, лавровый лист, душистый перец горошком, желатин, соль, хрен, горчица;Основные блюда;Русская кухня;https://eda.ru/recepty/osnovnye-blyuda/holodec-iz-kuricy-140157
Аджапсандали классический;баклажаны, сладкий перец, репчатый лук, кинза, красный базилик , укроп, петрушка, чеснок, помидоры, соль, подсолнечное масло;Основные блюда;Грузинская кухня;https://eda.ru/recepty/osnovnye-blyuda/adzhapsandal-32505
Курица Гастона Жерара;куриное филе, сыр грюйер, оливковое масло, цукини, шпинат, соль, мускатный орех, черный душистый перец, гвоздика, пшеничная мука, сливочное масло, молоко, лавровый лист, репчатый лук, молотый имбирь, дижонская горчица, молотый черный перец;Основные блюда;Французская кухня;https://eda.ru/recepty/osnovnye-blyuda/kurica-gastona-zherara-151448
Гречка с курицей;филе куриного бедра, гречневая крупа, репчатый лук, морковь, чеснок, томатная паста , вода, петрушка, укроп, соль, молотый черный перец, растительное масло;Основные блюда;Русская кухня;https://eda.ru/recepty/osnovnye-blyuda/grechnevaya-krupa-s-kuricey-151244
Картошка с тушенкой;картофель, репчатый лук, тушенка, лавровый лист, черный перец горошком, растительное масло, соль, молотый черный перец;Основные блюда;Русская кухня;https://eda.ru/recepty/osnovnye-blyuda/kartoshka-s-tushenkoy-139664
Англиийские рыбные котлеты;панировочные сухари, растительное масло, молотый черный перец, соль, зелень, репчатый лук, сахар, пшеничная мука, белая рыба, куриное яйцо;Основные блюда;Британская кухня;https://eda.ru/recepty/osnovnye-blyuda/angliijskie-ribnie-kotleti-16826
Индейка в духовке;индейка, петрушка, розмарин, репчатый лук, лимон, сливочное масло, оливковое масло, яблоко, апельсины, куриный бульон, молотый черный перец, соль;Основные блюда;Американская кухня;https://eda.ru/recepty/osnovnye-blyuda/indeyka-v-duhovke-140191
Рисовая лапша с курицей и овощами;куриное филе, рисовая лапша, огурцы, лук, морковь, соевый соус, оливковое масло;Основные блюда;Паназиатская кухня;https://eda.ru/recepty/osnovnye-blyuda/risovaja-lapsha-s-kuricej-i-ovoshhami-33423
Утиная грудка с морковным кремом и мушмулой;морковь, сливочное масло, тимьян, розмарин, свежевыжатый морковный сок, соус демигляс, утиная грудка, чеснок, мушмула, кристаллизованный сахар, черемша, соль, молотый черный перец;Основные блюда;Европейская кухня;https://eda.ru/recepty/osnovnye-blyuda/utinaya-grudka-s-morkovnym-kremom-i-mushmuloy-93126
Утка с яблоками и гречкой;утка, антоновские яблоки, гречневая крупа, сливочное масло, мед, соль, молотый черный перец;Основные блюда;Русская кухня;https://eda.ru/recepty/osnovnye-blyuda/utka-s-jablokami-grechkoj-18566
Маафе;баранина, репчатый лук, растительное масло, батат, морковь, помидоры, томатный соус пассата, арахисовая паста, вода, перец чили, молотый черный перец, соль;Основные блюда;Африканская кухня;https://eda.ru/recepty/osnovnye-blyuda/maafe-114835
Гречневая лапша по-японски с курицей и овощами;гречневая лапша , сладкий перец, куриное филе, репчатый лук, морковь, соевый соус, огурцы, сливочное масло, растительное масло, кунжутные семечки;Основные блюда;Японская кухня;https://eda.ru/recepty/osnovnye-blyuda/grechnevaja-lapsha-po-japonski-s-kuricej-i-ovoshhami-39126
Брокколи в азиатском стиле с булгуром и кедровыми орехами кимчи;капуста брокколи, лук-порей, соус наршараб, мята, кинза, лайм, лимон, рыбный соус, яблочный уксус, миндаль, кленовый сироп, оливковое масло extra virgin, рафинированное оливковое масло, булгур, соус кимчи, кедровые орехи, салат корн;Основные блюда;Китайская кухня;https://eda.ru/recepty/osnovnye-blyuda/brokkoli-v-aziatskom-stile-s-bulgurom-i-kedrovymi-orehami-kimchi-93193
Паэлья с кроликом;рис бомба, куриные окорочка, ножки кролика, белая фасоль, зеленая стручковая фасоль, консервированные помидоры кусочками, оливковое масло, куриный бульон, чеснок, соль, паприка, шафран, репчатый лук;Основные блюда;Испанская кухня;https://eda.ru/recepty/osnovnye-blyuda/paelya-s-krolikom-125568
Пельмени;пшеничная мука, вода, куриное яйцо, говядина, свинина, репчатый лук, чеснок, соль, молотый черный перец;Основные блюда;Русская кухня;https://eda.ru/recepty/osnovnye-blyuda/pelmeni-20811
Курица со сметаной и грибами;сметана, куриная грудка, грибы, репчатый лук;Основные блюда;Русская кухня;https://eda.ru/recepty/osnovnye-blyuda/kurica-so-smetanoj-gribami-23013
Хрустящая картошка, запеченная с грибами;картофель, репчатый лук, свежие шампиньоны, сметана, куриное яйцо, сыр, майонез;Основные блюда;Русская кухня;https://eda.ru/recepty/osnovnye-blyuda/hrustjaschaja-kartoshka-zapechennaja-s-gribami-21946
Куриная грудка со сморчками и сливочно-хересным соусом;куриное филе, сморчки, лук-шалот, херес, сливки 35%-ные, чеснок, растительное масло, тимьян, лавровый лист, молотый кориандр , розмарин, орегано, сливочное масло, молотый черный перец, соль;Основные блюда;Европейская кухня;https://eda.ru/recepty/osnovnye-blyuda/kurinaya-grudka-so-smorchkami-i-slivochno-heresnym-sousom-125230
Овощи в духовке;мини-картофель , капуста брокколи, морковь, красный лук, цукини, желтый сладкий перец, красный сладкий перец, лимон, чеснок, итальянские травы, соль, молотый черный перец;Основные блюда;Европейская кухня;https://eda.ru/recepty/osnovnye-blyuda/ovoschi-v-duhovke-151620
Гречневая лапша по-японски с курицей и овощами;гречневая лапша , сладкий перец, куриное филе, репчатый лук, морковь, соевый соус, огурцы, сливочное масло, растительное масло, кунжутные семечки;Основные блюда;Японская кухня;https://eda.ru/recepty/osnovnye-blyuda/grechnevaja-lapsha-po-japonski-s-kuricej-i-ovoshhami-39126
Кеджери с копченым лососем;рис, копченый лосось, куриный бульон, лимон, репчатый лук, куриное яйцо, сметана, перец чили, чеснок, лавровый лист, имбирь, петрушка, кинза, сливочное масло, оливковое масло, соль, молотый черный перец, шафран;Основные блюда;Британская кухня;https://eda.ru/recepty/osnovnye-blyuda/kedzheri-s-kopchenim-lososem-15658
Куриные голени в духовке;куриная голень, оливковое масло, паприка, молотый сушеный чеснок, лимонная цедра, молотый черный перец, соль;Основные блюда;Европейская кухня;https://eda.ru/recepty/osnovnye-blyuda/kurinye-goleni-v-duhovke-140156
Гречневая паэлья;гречневая крупа, куриная грудка, репчатый лук, белые грибы, сладкий перец, грибной бульон, томатная паста ;Основные блюда;Европейская кухня;https://eda.ru/recepty/osnovnye-blyuda/grechnevaya-paelya-93803
Пельмени;пшеничная мука, вода, куриное яйцо, говядина, свинина, репчатый лук, чеснок, соль, молотый черный перец;Основные блюда;Русская кухня;https://eda.ru/recepty/osnovnye-blyuda/pelmeni-20811
Курица со сметаной и грибами;сметана, куриная грудка, грибы, репчатый лук;Основные блюда;Русская кухня;https://eda.ru/recepty/osnovnye-blyuda/kurica-so-smetanoj-gribami-23013
Запеканка с грибами;картофель, шампиньоны, репчатый лук, чеснок, куриное яйцо, молоко, сливочное масло, укроп, панировочные сухари, растительное масло, соль, молотый черный перец;Основные блюда;Русская кухня;https://eda.ru/recepty/osnovnye-blyuda/zapekanka-s-gribami-140900
Хрустящая картошка, запеченная с грибами;картофель, репчатый лук, свежие шампиньоны, сметана, куриное яйцо, сыр, майонез;Основные блюда;Русская кухня;https://eda.ru/recepty/osnovnye-blyuda/hrustjaschaja-kartoshka-zapechennaja-s-gribami-21946
Сациви по рецепту Похлебкина;индейка, вода, репчатый лук, тимьян, топленое масло, кукурузная мука, грецкие орехи, чеснок, молотый черный перец, молотый кориандр , гвоздика, хмели-сунели, имеретинский шафран, винный уксус, соль;Основные блюда;Грузинская кухня;https://eda.ru/recepty/osnovnye-blyuda/sacivi-po-receptu-pohlebkina-126282
Маафе;баранина, репчатый лук, растительное масло, батат, морковь, помидоры, томатный соус пассата, арахисовая паста, вода, перец чили, молотый черный перец, соль;Основные блюда;Африканская кухня;https://eda.ru/recepty/osnovnye-blyuda/maafe-114835
