food;ingredients;category;kitchen;food_url
Сэндвичи с тунцом и сыром;консервированный тунец в собственном соку, хлеб для тостов, сыр эмменталь, розовый перец, каперсы, сливочное масло, огурцы;Сэндвичи;Американская кухня;https://eda.ru/recepty/sendvichi/sjendvichi-s-tuncom-sirom-29868
Сэндвичи с огурцом;огурцы, сливочное масло, хлеб для тостов, соль;Сэндвичи;Британская кухня;https://eda.ru/recepty/sendvichi/sendvichi-s-ogurcom-139835
Сэндвичи с омлетом;белый хлеб для тостов , ветчина, зеленый салат, куриное яйцо, помидоры, соль, молотый черный перец, майонез, плавленый сыр в нарезке, сливочное масло;Сэндвичи;Европейская кухня;https://eda.ru/recepty/sendvichi/sjendvichi-s-omletom-48356
Сэндвичи с яйцом и огурцом;огурцы, хлеб для тостов, куриное яйцо, натуральный йогурт, майонез, горчица, зеленый лук, соль;Сэндвичи;Британская кухня;https://eda.ru/recepty/sendvichi/sendvichi-s-yaycom-i-ogurcom-139836
Сэндвичи с семгой и творожным сыром;творожный сыр, оливковое масло, белый хлеб, бальзамический уксус, укроп, слабосоленая семга, листья латука, молотый черный перец;Сэндвичи;Скандинавская кухня;https://eda.ru/recepty/sendvichi/sendvichi-s-semgoy-i-tvorozhnym-syrom-29866
Сэндвичи с уткой;чиабатта, консервированные артишоки, утка, майонез, сыр проволоне, салями, сыр моцарелла, пармская ветчина, оливки, шпинат, рукола;Сэндвичи;Русская кухня;https://eda.ru/recepty/sendvichi/sjendvichi-s-utkoj-18791
Сэндвичи с грибами и моцареллой;оливковое масло, репчатый лук, свежие грибы, чеснок, белое сухое вино, измельченный свежий тимьян, рубленая петрушка, хлеб для тостов, сливочное масло, сыр моцарелла;Сэндвичи;Европейская кухня;https://eda.ru/recepty/sendvichi/sjendvichi-s-gribami-mocarelloj-25399
Сэндвичи с копченой моцареллой;чиабатта, сливочное масло, копченый сыр моцарелла, помидоры, листья базилика;Сэндвичи;Итальянская кухня;https://eda.ru/recepty/sendvichi/sjendvichi-s-kopchenoj-mocarelloj-19738
Сэндвичи с осенними овощами;цукини, баклажаны, помидоры, репчатый лук, морковь, сахар, томатная паста , соль, молотый черный перец, оливковое масло, сыр, деревенский хлеб, сушеный базилик;Сэндвичи;Европейская кухня;https://eda.ru/recepty/sendvichi/sjendvichi-s-osennimi-ovoshhami-34096
Сэндвичи с курицей и беконом;бекон, куриное филе, зеленый салат, помидоры, огурцы, сладкий красный лук, горчица, хлеб для тостов, сыр;Сэндвичи;Европейская кухня;https://eda.ru/recepty/sendvichi/sjendvichi-s-kuricej-i-bekonom-38870
Сэндвичи со шпротами;французский багет, чеснок, майонез, молотый черный перец, шпроты, огурцы;Сэндвичи;Европейская кухня;https://eda.ru/recepty/sendvichi/sjendvichi-so-shprotami-14750
Сэндвичи с помидорами и базиликом;цельнозерновой хлеб, легкий майонез, помидоры, измельченные листья базилика, крупная соль, свежемолотый черный перец;Сэндвичи;Американская кухня;https://eda.ru/recepty/sendvichi/sjendvichi-s-pomidorami-bazilikom-27893
Сэндвичи с ветчиной, сыром и бананом;белый хлеб, ветчина, сыр, бананы, сливочное масло;Сэндвичи;Американская кухня;https://eda.ru/recepty/sendvichi/sjendvichi-s-vetchinoj-sirom-i-bananom-54416
Сэндвичи с телятиной, чеддером и яблоками;тосты, телятина, сыр чеддер для сэндвичей, кислые яблоки, горчица с медом, сливочное масло;Сэндвичи;Клубный сэндвич;https://eda.ru/recepty/sendvichi/sjendvichi-s-teljatinoj-chedderom-i-jablokami-53260
Сэндвичи «Моцарелла ин кароцца»;белый хлеб для тостов , молоко, пшеничная мука, сыр моцарелла, оливковое масло extra virgin, куриное яйцо, соль;Сэндвичи;Клубный сэндвич;https://eda.ru/recepty/sendvichi/sjendvichi-mocarella-in-karocca-33161
Сэндвичи с яблоками, ветчиной и чеддером;цельнозерновой хлеб, горчица, ветчина, сыр чеддер, яблоко, сливочное масло;Сэндвичи;Американская кухня;https://eda.ru/recepty/sendvichi/sjendvichi-s-jablokami-vetchinoj-chedderom-29312
Сэндвичи на гриле с сыром и яблоками;зеленые яблоки, цельнозерновой хлеб, сыр чеддер, оливковое масло;Сэндвичи;Американская кухня;https://eda.ru/recepty/sendvichi/sjendvichi-na-grile-s-sirom-jablokami-22636
Сэндвичи на белом хлебе с форшмаком и яблоком;филе сельди, куриное яйцо, зеленые яблоки, сливочное масло, молотый черный перец, белый хлеб для тостов ;Сэндвичи;Открытый бутерброд;https://eda.ru/recepty/sendvichi/sjendvichi-na-belom-hlebe-s-forshmakom-i-jablokom-29867
Сэндвичи с козьим сыром и грецким орехом;сладкий перец, мягкий козий сыр, сливочный сыр, грецкие орехи, хлеб для тостов;Сэндвичи;Британская кухня;https://eda.ru/recepty/sendvichi/sendvichi-s-kozim-syrom-i-greckim-orehom-139837
Сэндвичи с тушеной говядиной и зеленым луком;говядина, репчатый лук, чеснок, соль, молотый черный перец, вода, томатная паста , соус барбекю, коричневый сахар, кукурузный крахмал, булочка, зеленый лук;Сэндвичи;Американская кухня;https://eda.ru/recepty/sendvichi/sjendvichi-s-tushenoj-govjadinoj-zelenim-lukom-21060
Сэндвичи с сырным кремом и свежей клубникой;сыр нешатель, мед, цедра апельсина, хлеб для тостов, клубника;Сэндвичи;Американская кухня;https://eda.ru/recepty/sendvichi/sjendvichi-s-sirnim-kremom-svezhej-klubnikoj-28201
Сэндвичи с салатом из сельдерея и соусом ремулад;корень сельдерея, мясо краба, яичный желток, сахар, растительное масло, соль, уксус, горчица, лимонный сок, корнишоны, каперсы, эстрагон, зеленые яблоки, листья латука, французский багет;Сэндвичи;Клубный сэндвич;https://eda.ru/recepty/sendvichi/sjendvichi-s-salatom-iz-seldereja-sousom-remulad-29865
Сэндвичи на гриле с говядиной, ветчиной и сыром;горчица, французский багет, говяжья вырезка, ветчина, маринованные огурцы, сыр проволоне, сливочное масло, соль, растительное масло, молотый черный перец;Сэндвичи;Американская кухня;https://eda.ru/recepty/sendvichi/sjendvichi-na-grile-s-govjadinoj-vetchinoj-sirom-23925
Сэндвичи с пармской ветчиной, галльской дыней и зеленым базиликом;чиабатта, пармская ветчина, галльская дыня, оливковое масло, зеленый базилик , лимон, молотый черный перец;Сэндвичи;Итальянская кухня;https://eda.ru/recepty/sendvichi/sjendvichi-s-parmskoj-vetchinoj-gallskoj-dinej-zelenim-bazilikom-16208
Сэндвичи с творожным кремом и соусом песто, с чесночными креветками;тигровые креветки, мягкий творог, чеснок, растительное масло, рукола, помидоры черри, песто, белый хлеб для тостов ;Сэндвичи;Европейская кухня;https://eda.ru/recepty/sendvichi/sjendvichi-s-tvorozhnim-kremom-i-sousom-pesto-s-chesnochnimi-krevetkami-40543
Сэндвичи с сосисками;греческий йогурт, кинза, лимонный сок, майонез «провансаль», дижонская горчица, томатный соус, зернистая горчица, свиные сосиски, говяжьи сосиски, куриные сосиски, оливковое масло, красный лук, красные яблоки, смесь салатных листьев, пита;Сэндвичи;Американская кухня;https://eda.ru/recepty/sendvichi/sjendvichi-s-sosickami-53970
Сэндвичи из фокаччи с рукколой, моцареллой, маринованным красным луком и помидорами;помидоры, красный лук, красный винный уксус, свежемолотый черный перец, рукола, фокачча, постный майонез, соль, сыр моцарелла;Сэндвичи;Европейская кухня;https://eda.ru/recepty/sendvichi/sjendvichi-iz-fokachchi-s-rukkoloj-mocarelloj-marinovannim-krasnim-lukom-pomidorami-27199
Сэндвичи с лососем на гриле, рукколой, помидорами и кремом из авокадо;филе лосося, специи каджун, авокадо, легкий майонез, цельнозерновая булочка , рукола, сливовидные помидоры, красный лук;Сэндвичи;Европейская кухня;https://eda.ru/recepty/sendvichi/sjendvichi-s-lososem-na-grile-rukkoloj-pomidorami-kremom-iz-avokado-28547
Сэндвичи с лисичками и яйцами;сливочное масло, лук-шалот, лисички, крупная соль, свежемолотый черный перец, деревенский хлеб, листья базилика, куриное яйцо (крупное);Сэндвичи;Американская кухня;https://eda.ru/recepty/sendvichi/sjendvichi-s-lisichkami-jajcami-29472
Сэндвичи с селедкой и сыром фета;сельдь в красном винном соусе, помидоры, сыр фета, лайм, натуральный йогурт, шнитт-лук, укроп, ржаной хлеб, зеленый салат, молотый белый перец;Сэндвичи;Клубный сэндвич;https://eda.ru/recepty/sendvichi/sjendvichi-s-seledkoj-sirom-feta-29873
Сэндвичи со свининой;свиная вырезка, соль, молотый черный перец, дижонская горчица, оливковое масло, лимонный сок, панировочные сухари, несоленое сливочное масло, измельченные листья шалфея, чеснок, швейцарский сыр, каперсы, рукола, круглая булочка;Сэндвичи;Американская кухня;https://eda.ru/recepty/sendvichi/sjendvichi-so-svininoj-54784
Сэндвичи по-средиземноморски;французский цельнозерновой багет, мягкий козий сыр, сладкий перец, цукини, зелень, оливковое масло;Сэндвичи;Средиземноморская кухня;https://eda.ru/recepty/sendvichi/sjendvichi-po-sredizemnomorski-40167
Сэндвичи с ветчиной и томатным соусом;французский багет, помидоры, ветчина, лимон, чеснок, петрушка, оливковое масло, соль, молотый черный перец, бальзамический уксус;Сэндвичи;Клубный сэндвич;https://eda.ru/recepty/sendvichi/sjendvichi-s-vetchinoj-tomatnim-sousom-14429
Сэндвичи со свежим мясным хлебом, рукколой, майонезным соусом и цельнозерновым хлебом;майонез, кетчуп, цельнозерновой хлеб, мясной хлеб, рукола;Сэндвичи;Хлеб;https://eda.ru/recepty/sendvichi/sjendvichi-so-svezhim-mjasnim-hlebom-rukkoloj-majoneznim-sousom-celnozernovim-hlebom-21595
Сэндвичи с сыром и сливочным маслом;сливочное масло, твердый сыр, нарезной батон;Сэндвичи;Американская кухня;https://eda.ru/recepty/sendvichi/sjendvichi-s-sirom-i-slivochnim-maslom-35391
Сэндвичи с грушами, грюйером и ветчиной;хлеб для тостов, сыр грюйер, груши, сливочное масло, ветчина;Сэндвичи;Американская кухня;https://eda.ru/recepty/sendvichi/sjendvichi-s-grushami-grjujerom-vetchinoj-29545
Сэндвичи с печенью трески, красным луком и перцем;печень трески, красный лук, сладкий перец, сливочное масло, петрушка, цельнозерновой хлеб;Сэндвичи;Американская кухня;https://eda.ru/recepty/sendvichi/sjendvichi-s-pechenju-treski-krasnim-lukom-i-percem-34015
Английские сэндвичи с огурцами;сливочное масло, свежая мята, цельнозерновой хлеб, сливочный сыр, огурцы, соль;Сэндвичи;Британская кухня;https://eda.ru/recepty/sendvichi/angliyskie-sendvichi-s-ogurcami-69188
Мягкие сэндвичи с сыром;сыр рикотта, сыр маскарпоне, сливки 40%-ные, зеленый лук, белый хлеб, ржаной хлеб;Сэндвичи;Европейская кухня;https://eda.ru/recepty/sendvichi/mjagkie-sjendvichi-s-sirom-15717
Горячие сэндвичи с грибами и томатами;помидоры, сливочное масло, свежие грибы, мелко рубленный чеснок, хлеб для тостов, рукола, сыр чеддер для сэндвичей;Сэндвичи;Закрытый бутерброд;https://eda.ru/recepty/sendvichi/gorjachie-sjendvichi-s-gribami-tomatami-25162
Жареные сэндвичи с беконом и грушей;белый хлеб, бекон, груши «бартлетт», белый сыр чеддер, сливочное масло;Сэндвичи;Клубный сэндвич;https://eda.ru/recepty/sendvichi/zharenie-sjendvichi-s-bekonom-grushej-27333
Легкие сэндвичи с прошутто и моцареллой;прошутто, консервированный жареный перец, сыр моцарелла, цельнозерновой хлеб;Сэндвичи;Итальянская кухня;https://eda.ru/recepty/sendvichi/legkie-sjendvichi-s-proshutto-mocarelloj-28545
Легкие сэндвичи с авокадо и копченым лососем;авокадо, легкий майонез, лимонный сок, свежемолотый черный перец, цельнозерновой хлеб, копченый лосось, огурцы;Сэндвичи;Британская кухня;https://eda.ru/recepty/sendvichi/legkie-sjendvichi-s-avokado-kopchenim-lososem-28544
Летние сэндвичи с домашним хлебом;ржаная мука, пшеничная мука, сухие дрожжи, сахар, соль, вода, семечки подсолнуха, прованские травы, зеленый салат, сладкий перец, маринованные огурцы, куриное яйцо, салями, кисло-сладкий соус;Сэндвичи;Британская кухня;https://eda.ru/recepty/sendvichi/letnie-sendvichi-s-domashnim-hlebom-93243
Диетические сэндвичи с морковью, яйцом и чесноком;цельнозерновой хлеб, морковь, куриное яйцо, чеснок, натуральный йогурт;Сэндвичи;Британская кухня;https://eda.ru/recepty/sendvichi/dieticheskie-sendvichi-s-morkovyu-yaycom-i-chesnokom-91991
Быстрые сэндвичи с лососем, овощами и рикоттой;консервированный лосось, красный лук, оливковое масло extra virgin, лимонный сок, свежемолотый черный перец, пумперникель, сыр рикотта, помидоры, листья латука;Сэндвичи;Американская кухня;https://eda.ru/recepty/sendvichi/bistrie-sjendvichi-s-lososem-ovoschami-rikottoj-28551
Быстрые сэндвичи с консервированным лососем и васаби;легкий майонез, лимонный сок, соевый соус, сахар, тертый имбирь, консервированный лосось, рубленный стебель сельдерея , зеленый рубленый лук, порошок васаби, цельнозерновой хлеб;Сэндвичи;Американская кухня;https://eda.ru/recepty/sendvichi/bistrie-sjendvichi-s-konservirovannim-lososem-vasabi-28549
Сладкие сэндвичи с арахисом, клубникой и бананом;хлеб для тостов, сливочное масло, мед, арахисовая паста, шоколадные чипсы (мини), клубника, бананы, ананасовый джем ;Сэндвичи;Европейская кухня;https://eda.ru/recepty/sendvichi/sladkie-sjendvichi-s-arahisom-klubnikoj-bananom-23537
Куриные сэндвичи с курицей гриль и соусом барбекю;курица гриль, соус барбекю, ананасовый джем , чили-пудра, хлеб для тостов, латук, помидоры;Сэндвичи;Американская кухня;https://eda.ru/recepty/sendvichi/kurinie-sjendvichi-s-kuricej-gril-sousom-barbekju-22409
Сырные сэндвичи с карамелизованными яблоками на гриле;сливочное масло, коричневый сахар, молотая корица, яблоко, хлеб для тостов, сыр чеддер;Сэндвичи;Сырные закуски;https://eda.ru/recepty/sendvichi/sirnie-sjendvichi-s-karamelizovannimi-jablokami-na-grile-25869
Слоеные сэндвичи с салями и пюре из лука-порея;лук-порей, сельдерей, слоеное тесто, острая салями, семена фенхеля, греческий йогурт, оливковое масло extra virgin, соль, молотый черный перец, вода;Сэндвичи;Американская кухня;https://eda.ru/recepty/sendvichi/sloenie-sjendvichi-s-saljami-i-pjure-iz-luka-poreja-37120
Итальянские сэндвичи с говядиной;красный винный уксус, маринованный перец, стебель сельдерея, перец халапеньо, красный перец хлопьями, соль, молотый черный перец, сушеный базилик, сушеный орегано, чеснок, говяжья вырезка, булочка;Сэндвичи;Итальянская кухня;https://eda.ru/recepty/sendvichi/italjanskie-sjendvichi-s-govjadinoj-54514
Низкокалорийные сэндвичи с овощами и фетой;зеленый лук перья, сыр фета, бородинский хлеб, помидоры, салат айсберг, огурцы;Сэндвичи;Американская кухня;https://eda.ru/recepty/sendvichi/nizkokalorijnie-sjendvichi-s-ovoshhami-i-fetoj-37697
Холодные сэндвичи с фетой и томатами;хлеб для тостов, помидоры, зеленый базилик , чеснок, сыр фета, оливковое масло;Сэндвичи;Средиземноморская кухня;https://eda.ru/recepty/sendvichi/holodnie-sjendvichi-s-fetoj-tomatami-30864
Закусочные сэндвичи из питы;пита, плавленый сыр, репчатый лук, шерри, карри, соль, молотый черный перец;Сэндвичи;Европейская кухня;https://eda.ru/recepty/sendvichi/zakusochnie-sjendvichi-iz-piti-40968
Жареные ржаные сэндвичи с шукрутом и грюйером;ржаной хлеб, сыр грюйер, шукрут, сливочное масло;Сэндвичи;Европейская кухня;https://eda.ru/recepty/sendvichi/zharenie-rzhanie-sjendvichi-s-shukrutom-grjujerom-27332
Французские тосты с яблоками;топленое масло, бриошь, куриное яйцо, сахар, сливки, яблоко, корица, молотый мускатный орех, сахарная пудра;Сэндвичи;Французская кухня;https://eda.ru/recepty/sendvichi/francuzskie-tosti-s-jablokami-20728
Сэндвич с яичницей, беконом и сыром;бекон, белый хлеб, сыр эдам, помидоры, майонез, сливочное масло, куриное яйцо, листья латука;Сэндвичи;Американская кухня;https://eda.ru/recepty/sendvichi/sjendvich-s-jaichnicej-bekonom-sirom-17380
Домашняя шаурма с курицей;помидоры, петрушка, сметана, чеснок, кетчуп, майонез, армянский лаваш, филе куриной грудки, молодая капуста, огурцы, сладкий перец, соль, белый винный уксус, оливковое масло, морковь по-корейски, зелень, красный лук, сахар, специи, растительное масло;Сэндвичи;Авторская кухня;https://eda.ru/recepty/sendvichi/domashnyaya-shaurma-s-kuricey-41324
Бутерброд с творожным сыром и печеным перцем;красный сладкий перец, французский багет, творожный сыр, растительное масло, чеснок, бальзамический уксус, зеленый салат, твердый сыр, соль, молотый черный перец;Сэндвичи;Европейская кухня;https://eda.ru/recepty/sendvichi/buterbrod-s-tvorozhnym-syrom-i-pechenym-percem-58363
Гамбургер с соусом тартар;говядина, кетчуп, булочка 8 злаков, красный лук, помидоры, куриное яйцо, салат айсберг, соус тартар;Сэндвичи;Французская кухня;https://eda.ru/recepty/sendvichi/gamburger-s-sousom-tartar-24298
Роти-джон;французский багет, говяжий фарш, репчатый лук, зеленый перец чили , красный перец чили, зеленый лук, куриное яйцо, растительное масло, соль;Сэндвичи;Малайзийская кухня;https://eda.ru/recepty/sendvichi/roti-dzhon-114338
Клаб-сэндвич;хлеб для тостов, майонез, дижонская горчица, листья латука, сыр чеддер, грудка индейки, помидоры, бекон;Сэндвичи;Американская кухня;https://eda.ru/recepty/sendvichi/klab-sendvich-136855
