food;ingredients;category;kitchen;food_url
Гренки с овощами;белый хлеб, молоко, сахар, куриное яйцо, сливочное масло, сметана, белокочанная капуста, морковь, кабачки, яблоко, зеленый салат, укроп;Сэндвичи;Европейская кухня;https://eda.ru/recepty/sendvichi/grenki-s-ovoschami-15353
Брускетта с желтыми черри и травами;бриошь, желтые помидоры черри , зелень, оливковое масло extra virgin, крупная соль, свежемолотый черный перец;Сэндвичи;Итальянская кухня;https://eda.ru/recepty/sendvichi/brusketta-s-zheltimi-cherri-travami-29161
Шаурма в сырном лаваше;капуста, сырный армянский лаваш, помидоры, курица, огурцы, томатный соус, чесночный соус, соль, молотый черный перец, рукола;Сэндвичи;Кавказская кухня;https://eda.ru/recepty/sendvichi/shaurma-v-sirnom-lavashe-41862
Бутерброды с перепелиными яйцами;белый хлеб, рыба холодного копчения, перепелиное яйцо, зеленый лук, зелень;Сэндвичи;Французская кухня;https://eda.ru/recepty/sendvichi/buterbrodi-s-perepelinimi-jajcami-14788
Бутерброды с творожным кремом и луком;творожный крем, бородинский хлеб, помидоры, зеленый лук;Сэндвичи;Открытый бутерброд;https://eda.ru/recepty/sendvichi/buterbrodi-s-tvorozhnim-kremom-lukom-14803
Овощная шаурма с чесночным соусом;сладкий перец, цветки цукини, помидоры черри, зелень, легкий майонез, сливочный сыр, чеснок, армянский лаваш;Сэндвичи;Арабская кухня;https://eda.ru/recepty/sendvichi/ovoschnaja-shaurma-s-chesnochnim-sousom-30800
Бутерброд с сырным маслом;белый хлеб, сырное масло, сыр, помидоры;Сэндвичи;Открытый бутерброд;https://eda.ru/recepty/sendvichi/buterbrod-s-sirnim-maslom-14746
Бутерброд с брынзой;ветчина, бородинский хлеб, сыр брынза, зелень, помидоры;Сэндвичи;Европейская кухня;https://eda.ru/recepty/sendvichi/buterbrod-s-brinzoj-14742
Сэндвич с курицей и овощами;репчатый лук, огурцы, столовый уксус, майонез, хлеб для тостов, филе куриной грудки;Сэндвичи;Американская кухня;https://eda.ru/recepty/sendvichi/sjendvich-s-kuricej-i-ovoshhami-44469
Горячие бутерброды с колбасой и сыром в духовке;майонез, нарезной батон, вареная колбаса, помидоры, сыр;Сэндвичи;Европейская кухня;https://eda.ru/recepty/sendvichi/gorjachie-buterbrodi-s-kolbasoj-i-sirom-v-duhovke-38420
Быстрые бургеры с тунцом, латуком и помидором;консервированный тунец в собственном соку, панировочные сухари, легкий майонез, консервированный перец пименто , рубленный стебель сельдерея , репчатый лук, специи, оливковое масло extra virgin, цельнозерновая булочка , листья латука, помидоры;Сэндвичи;Американская кухня;https://eda.ru/recepty/sendvichi/bistrie-burgeri-s-tuncom-latukom-pomidorom-28548
Бутерброды с морковью и чесноком;сливочное масло, морковь, чеснок, куриное яйцо, майонез, зелень, белый хлеб;Сэндвичи;Русская кухня;https://eda.ru/recepty/sendvichi/buterbrodi-s-morkovju-chesnokom-14721
Сэндвич с курицей и яйцом;куриная грудка, куриное яйцо, огурцы, плавленый сыр, хлеб для тостов;Сэндвичи;Американская кухня;https://eda.ru/recepty/sendvichi/sjendvich-s-kuricej-i-jajcom-52329
Сэндвич с курицей с чиабаттой;зеленый салат, куриное филе, огурцы, чиабатта мини, плавленый сыр, соль;Сэндвичи;Европейская кухня;https://eda.ru/recepty/sendvichi/sjendvich-s-kuricej-s-chiabattoj-48713
Сэндвич с курицей в аэрогриле;куриное филе, кетчуп, салат айсберг, сыр мини моцарелла , белый хлеб для тостов ;Сэндвичи;Европейская кухня;https://eda.ru/recepty/sendvichi/sjendvich-s-kuricej-v-ajerogrile-33115
Бутерброд с сыром и фруктами;белый хлеб, сливочное масло, сыр, грецкие орехи, фрукты;Сэндвичи;Открытый бутерброд;https://eda.ru/recepty/sendvichi/buterbrod-s-sirom-fruktami-14749
Сэндвич гриль со шпинатом и фетой;ржаной хлеб, чеснок, оливковое масло, красный лук, свежие листья шпината, укроп, сыр фета, сыр пармезан;Сэндвичи;Европейская кухня;https://eda.ru/recepty/sendvichi/sendvich-gril-so-shpinatom-i-fetoy-55960
Сэндвич с салями к красному вину;панчетта, салями;Сэндвичи;Итальянская кухня;https://eda.ru/recepty/sendvichi/sjendvich-s-saljami-k-krasnomu-vinu-24953
Шаурма с соевым соусом и медом;армянский лаваш, соевый соус, свинина, мед, оливковое масло, морковь по-корейски, салат айсберг, сладкий перец, огурцы, кунжут;Сэндвичи;Русская кухня;https://eda.ru/recepty/sendvichi/shaurma-s-soevim-sousom-i-medom-43389
Шаверма в пите;пита, куриное филе, помидоры, зелень, огурцы, майонез, сметана, ряженка , чеснок, куриный бульонный кубик , карри, растительное масло;Сэндвичи;Узбекская кухня;https://eda.ru/recepty/sendvichi/shaverma-v-pite-50130
Бургер из мраморной говядины в чиабатте;чиабатта, помидоры, домашний майонез, огурцы, мраморная говядина, вустерширский соус, дижонская горчица, морская соль, молотый черный перец, зеленый салат, плавленый сырок;Сэндвичи;Американская кухня;https://eda.ru/recepty/sendvichi/burger-iz-mramornoj-govjadini-v-chiabatte-43854
Бутерброды с голубым сыром и беконом;бекон, сливочное масло, белый хлеб, голубой сыр, сметана, оливковое масло;Сэндвичи;Французская кухня;https://eda.ru/recepty/sendvichi/buterbrodi-s-golubim-sirom-bekonom-17368
Датский открытый сэндвич с паштетом и салями;ржаной хлеб, сливочное масло, печеночный паштет, салями, соус ремулад, апельсины, маринованные огурцы, соль, свежемолотый черный перец, листья петрушки, жареный лук;Сэндвичи;Датская кухня;https://eda.ru/recepty/sendvichi/datskij-otkritij-sjendvich-s-pashtetom-saljami-31689
Сэндвич с козьим сыром и шпинатом;белый хлеб, сливочное масло, козий сыр, консервированный перец, шпинат;Сэндвичи;Авторская кухня;https://eda.ru/recepty/sendvichi/sjendvich-s-kozim-sirom-shpinatom-16994
Сэндвич с жареной говядиной, сыром и соусом с хреном;булочка из непросеянной муки, говяжье филе, листья латука, швейцарский сыр, красный лук, легкий майонез, хрен, соль, растительное масло, молотый черный перец;Сэндвичи;Американская кухня;https://eda.ru/recepty/sendvichi/sjendvich-s-zharenoj-govjadinoj-sirom-sousom-s-hrenom-23923
Жареные канапе;молоко, сливочное масло, пшеничная мука, сыр грюйер, куриное яйцо, белый хлеб, оливковое масло, соль, молотый черный перец;Сэндвичи;Русская кухня;https://eda.ru/recepty/sendvichi/zharenie-kanape-15713
Сэндвич с семгой, авокадо и зеленым салатом;тосты, филе семги, авокадо, майонез, сметана, зеленый салат;Сэндвичи;Европейская кухня;https://eda.ru/recepty/sendvichi/sjendvich-s-semgoj-avokado-i-zelenim-salatom-48352
Гамбургер обыкновенный;булочка с кунжутом, говяжий фарш, репчатый лук, чеснок, соль, молотый черный перец, соленые огурцы, горчица, кетчуп, помидоры, оливковое масло;Сэндвичи;Американская кухня;https://eda.ru/recepty/sendvichi/gamburger-obiknovennij-44408
Бутерброд с красной рыбой;французский чесночный багет, красная рыба, сыр брынза, зелень;Сэндвичи;Русская кухня;https://eda.ru/recepty/sendvichi/buterbrod-s-krasnoj-riboj-32721
Канадский бутерброд;чеснок, майонез, бородинский хлеб, шпроты, сыр, лимон, маринованные огурцы;Сэндвичи;Закрытый бутерброд;https://eda.ru/recepty/sendvichi/kanadskij-buterbrod-14784
Бейгл с семгой;пшеничная мука, вода, свежие дрожжи, сахар, соль, оливковое масло, сухие дрожжи, слабосоленая семга, творожный сыр, салат айсберг;Сэндвичи;Европейская кухня;https://eda.ru/recepty/sendvichi/bejgl-s-semgoj-40871
Бургеры на гриле с фетой и жаренным красным луком;говяжий фарш, орегано, сыр фета, соль, молотый черный перец, чеснок, оливковое масло, репчатый лук, булочка, помидоры;Сэндвичи;Американская кухня;https://eda.ru/recepty/sendvichi/burgeri-na-grile-s-fetoj-zharennim-krasnim-lukom-17534
Французские шоколадные тосты;какао-порошок, батон, куриное яйцо, молоко, жирные сливки, сахар, ванилин, соль, шоколадная стружка, кипяток;Сэндвичи;Европейская кухня;https://eda.ru/recepty/sendvichi/francuzskie-shokoladnie-tosti-30931
Булочки с морковной начинкой и хумусом;цельнозерновая булочка , хумус, морковь, кресс-салат;Сэндвичи;Детское меню;https://eda.ru/recepty/sendvichi/bulochki-s-morkovnoj-nachinkoj-humusom-23136
Бутерброды с ветчиной и яйцом к завтраку;белый хлеб для тостов , ветчина, помидоры, грибы, куриное яйцо, сыр, сливочное масло, соль, зелень, молотый черный перец;Сэндвичи;Русская кухня;https://eda.ru/recepty/sendvichi/buterbrody-s-vetchinoy-i-yaycom-k-zavtraku-56933
По-бой сендвич с устрицами;майонез, консервированный перец чипотле , свежевыжатый лимонный сок, растительное масло, молоко, свежие очищенные устрицы, кукурузная мука, куриное яйцо (крупное), французский багет, салат айсберг, лимон;Сэндвичи;Американская кухня;https://eda.ru/recepty/sendvichi/po-boj-sendvich-s-ustricami-49232
Канапе «Маргарита»;белый хлеб, сыр, сливочное масло, ветчина;Сэндвичи;Авторская кухня;https://eda.ru/recepty/sendvichi/kanape-margarita-15823
Брускетта с пармской ветчиной и томатной приправой;оливковое масло, французский багет, базилик, рубленая петрушка, лимон, рукола, пармская ветчина, чеснок, помидоры, томатное пюре, tabasco®, бальзамический уксус, соль, молотый черный перец;Сэндвичи;Итальянская кухня;https://eda.ru/recepty/sendvichi/brusketta-s-parmskoj-vetchinoj-tomatnoj-pripravoj-18024
Сэндвич с макрелевым тунцом и овощами, обжаренными на гриле;макрель, помидоры, зеленый лук с луковицей, зеленый перец, свежие шампиньоны, красный перец чили, чиабатта;Сэндвичи;Испанская кухня;https://eda.ru/recepty/sendvichi/sjendvich-s-makrelevim-tuncom-ovoschami-obzharennimi-na-grile-27713
Кростини с огурцами;молотый черный перец, плавленый сыр, сушеный укроп, чеснок, французский багет, огурцы, соль, паприка;Сэндвичи;Итальянская кухня;https://eda.ru/recepty/sendvichi/krostini-s-ogurcami-51351
Сэндвич крок-мадам;варено-копченая говядина, сыр моцарелла, сыр гауда, куриное яйцо, ржаной хлеб, маринованные огурцы, горчица, уксус, укроп, молотый черный перец, тростниковый сахар, соль, легкий майонез;Сэндвичи;Итальянская кухня;https://eda.ru/recepty/sendvichi/sendvich-krok-madam-91582
Бутерброд с ветчиной и яйцом;зеленое масло, бородинский хлеб, ветчина, куриное яйцо, соленые огурцы, хрен, сметана;Сэндвичи;Открытый бутерброд;https://eda.ru/recepty/sendvichi/buterbrod-s-vetchinoj-jajcom-14758
Сэндвич с козьим сыром, авокадо и копченой индейкой на ореховом хлебе;помидоры, зеленый лук, листья кинзы (кориандра), козий сыр, ореховый хлеб, авокадо, копченая индейка;Сэндвичи;Европейская кухня;https://eda.ru/recepty/sendvichi/sjendvich-s-kozim-sirom-avokado-kopchenoj-indejkoj-na-orehovom-hlebe-15616
Хот-доги с фаршем;фарш, лук, вода, томатный соус, сыр моцарелла, булочка для хот-дога, горчица, молотый красный перец, чеснок, оливковое масло, соль;Сэндвичи;Американская кухня;https://eda.ru/recepty/sendvichi/hot-dogi-s-farshem-55513
Ржаные тосты с паштетом из камамбера и тмина;сыр камамбер, сыр маскарпоне, сметана, лук-шалот, молотый черный перец, семена тмина, шнитт-лук, ржаной хлеб, сливочное масло;Сэндвичи;Открытый бутерброд;https://eda.ru/recepty/sendvichi/rzhanie-tosti-s-pashtetom-iz-kamambera-tmina-20507
Бургер с каперсами, помидором и майонезом;фарш, помидоры, свежие шампиньоны, маринованные каперсы, легкий майонез, лимон, соевый соус, зеленый салат, оливковое масло, молотый черный перец;Сэндвичи;Европейская кухня;https://eda.ru/recepty/sendvichi/burger-s-kapersami-pomidorom-i-majonezom-32230
Брускетта с анчоусами и пармезаном;белый хлеб, оливковое масло, помидоры в собственном соку, анчоусы, свежемолотый черный перец, мелко рубленный чеснок, тертый сыр пармезан , базилик;Сэндвичи;Итальянская кухня;https://eda.ru/recepty/sendvichi/brusketta-s-anchousami-i-parmezanom-32774
Бутерброды со скумбрией;белый хлеб, рыба, чеснок, помидоры, сыр моцарелла;Сэндвичи;Русская кухня;https://eda.ru/recepty/sendvichi/buterbrodi-so-skumbriej-14734
Бутерброд с цыпленком;белый хлеб, соль, куриная грудка, молотый черный перец, лимонный сок, растительное масло;Сэндвичи;Открытый бутерброд;https://eda.ru/recepty/sendvichi/buterbrod-s-ciplenkom-14766
Жареный на гриле сэндвич с капрезе;белый хлеб, помидоры, сыр моцарелла, песто, молотый черный перец, оливковое масло;Сэндвичи;Итальянская кухня;https://eda.ru/recepty/sendvichi/zharenij-na-grile-sjendvich-s-kapreze-42736
Бутерброды с клубникой;белый хлеб, сливочное масло, клубника, молотый черный перец, сахарная пудра;Сэндвичи;Датская кухня;https://eda.ru/recepty/sendvichi/buterbrodi-s-klubnikoj-16016
Брускетта с креветками;французский багет, чеснок, креветки, авокадо, редис, сливочный сыр, салат фризе;Сэндвичи;Итальянская кухня;https://eda.ru/recepty/sendvichi/brusketta-s-krevetkami-43218
Сэндвич с семгой и свежими овощами;ржаной хлеб, слабосоленая семга, лимонный сок, соль, сахар, огурцы, лук, редис, мягкий обезжиренный творог, укроп, петрушка;Сэндвичи;Европейская кухня;https://eda.ru/recepty/sendvichi/sjendvich-s-semgoj-i-svezhimi-ovoshhami-48382
Тост «а ля рюс»;печень трески, авокадо, рукола, французский багет, бальзамический крем, чеснок;Сэндвичи;Европейская кухня;https://eda.ru/recepty/sendvichi/tost-a-lja-rjus-50202
Тыквенные французские тосты со специями;куриное яйцо, молоко, тыквенное пюре, ваниль, молотая корица, молотый имбирь, молотый мускатный орех, молотая гвоздика, коричневый сахар, белый хлеб;Сэндвичи;Европейская кухня;https://eda.ru/recepty/sendvichi/tikvennie-francuzskie-tosti-so-specijami-25344
Паштет из говяжьей печени с морковью и луком;говяжья печень, сливочное масло, репчатый лук, морковь, растительное масло, лавровый лист, соль, молотый черный перец;Сэндвичи;Европейская кухня;https://eda.ru/recepty/sendvichi/pashtet-iz-govjazhej-pecheni-s-morkovju-i-lukom-49274
Кесадилья с курицей и грибами;тортильи, шампиньоны, куриное филе, помидоры, тертый сыр, свежая кинза (кориандр), молотый кориандр , соль, молотый черный перец, томатная паста , перец чили, красный сладкий перец;Сэндвичи;Мексиканская кухня;https://eda.ru/recepty/sendvichi/kesadilja-s-kuricej-i-gribami-45164
Тако;говяжий фарш, зеленый салат, лепешки «тако», помидоры, сыр чеддер, соус тако, смесь специй тако;Сэндвичи;Мексиканская кухня;https://eda.ru/recepty/sendvichi/tako-45140
Куриный ролл из лаваша;армянский лаваш, сладкий перец, куриная грудка, помидоры черри, шпинат, специи, tabasco®;Сэндвичи;Европейская кухня;https://eda.ru/recepty/sendvichi/kurinij-roll-iz-lavasha-43990
Легендарный сэндвич Флаффернаттер (Fluffernutter);арахисовая паста, хлеб для тостов, кремообразный зефир;Сэндвичи;Американская кухня;https://eda.ru/recepty/sendvichi/legendarnij-sjendvich-flaffernatter-fluffernutter-41959
Сэндвич со свежими овощами и сыром;булочка из непросеянной муки, ростки люцерны, помидоры, морковь, огурцы, горчица с медом, сыр проволоне;Сэндвичи;Американская кухня;https://eda.ru/recepty/sendvichi/sjendvich-so-svezhimi-ovoschami-sirom-23924
Сэндвич Элвиса;белый хлеб, арахисовое масло, бананы;Сэндвичи;Американская кухня;https://eda.ru/recepty/sendvichi/sjendvich-jelvisa-20954
Гренки по-итальянски с сыром и укропом;укроп, молоко, белый хлеб, куриное яйцо, соль, твердый сыр, молотый черный перец;Сэндвичи;Итальянская кухня;https://eda.ru/recepty/sendvichi/grenki-po-italjanski-s-sirom-i-ukropom-35120
Сэндвич с тунцом, яблоком и листьями салата;булочка с кунжутом, консервированный тунец в собственном соку, зеленые яблоки, зеленый салат, сметана;Сэндвичи;;https://eda.ru/recepty/sendvichi/sjendvich-s-tuncom-jablokom-listjami-salata-18520
Бургеры из индейки с сыром сулугуни;фарш из индейки, зеленый салат, помидоры, рубленая петрушка, измельченный укроп, специи, сметана 25%-ная, булочка, куриное яйцо, сыр сулугуни, репчатый лук;Сэндвичи;Авторская кухня;https://eda.ru/recepty/sendvichi/burgeri-iz-indejki-s-sirom-suluguni-43662
Булочки с сосисками и пармезаном;куриное яйцо, дрожжевое тесто, молоко, копченые сосиски, тертый сыр пармезан ;Сэндвичи;Итальянская кухня;https://eda.ru/recepty/sendvichi/bulochki-s-sosiskami-i-parmezanom-41872
Куриный паштет с орехами;куриное филе, грецкие орехи, зелень, плавленый сырок;Сэндвичи;Греческая кухня;https://eda.ru/recepty/sendvichi/kurinij-pashtet-s-orehami-36483
Хлебцы с омлетом;тосты, куриное яйцо, сливочное масло, сливки, зеленый перец, репчатый лук, помидоры, петрушка, соль, сыр фета, паприка;Сэндвичи;Хлеб;https://eda.ru/recepty/sendvichi/hlebci-s-omletom-14731
Вегетарианский ролл;сыр сулугуни, помидоры, красный базилик , салат айсберг, армянский лаваш, бальзамический уксус;Сэндвичи;Русская кухня;https://eda.ru/recepty/sendvichi/vegetarianskij-roll-35814
Сэндвич с говядиной и квашеной капустой;говядина, ржаной хлеб, швейцарский сыр, майонез, квашеная капуста, кетчуп, вустерширский соус, соль, молотый черный перец;Сэндвичи;Закрытый бутерброд;https://eda.ru/recepty/sendvichi/sjendvich-s-govjadinoj-i-kvashenoj-kapustoj-32628
