food;ingredients;category;kitchen;food_url
Буузы (Традиционное бурятское блюдо);пшеничная мука, говяжий фарш, лук, вода, куриное яйцо, соль, молотый черный перец, свинина;Основные блюда;Бурятская кухня;https://eda.ru/recepty/osnovnye-blyuda/buuzi-tradicionnoe-burjatskoe-bljudo-42067
Пибимпап (корейское блюдо);папоротник, морковь, куриное яйцо, шпинат, рис, соевые бобы, соевый соус, кабачки, жареный кунжут, говядина, чеснок;Основные блюда;Корейская кухня;https://eda.ru/recepty/osnovnye-blyuda/pibimpap-koreyskoe-blyudo-49883
Мексиканское блюдо из фасоли и говяжьего фарша;репчатый лук, говяжий фарш, красная консервированная фасоль, зеленая стручковая фасоль (замороженная), замороженный зеленый горошек , томатная паста , аджика, сыр, сливочное масло, консервированная кукуруза;Основные блюда;Мексиканская кухня;https://eda.ru/recepty/osnovnye-blyuda/meksikanskoe-bljudo-iz-fasoli-i-govjazhego-farsha-40984
Вегетарианское блюдо чили за 15 минут;консервированная фасоль, черная консервированная  фасоль, консервированные помидоры, овощной бульон, зеленый консервированный перец чили;Основные блюда;Европейская кухня;https://eda.ru/recepty/osnovnye-blyuda/vegetarianskoe-blyudo-chili-za-15-minut-57609
Острое блюдо из нута, томатов и шпината;репчатый лук, чеснок, тертый имбирь, помидоры, растительное масло, молотый тмин, молотый кориандр , куркума, перец чили хлопьями, сухие дрожжи, красная чечевица, кокосовый крем, капуста брокколи, консервированный нут, шпинат, лимон, жареный кунжут, кешью;Основные блюда;Европейская кухня;https://eda.ru/recepty/osnovnye-blyuda/ostroe-blyudo-iz-nuta-tomatov-i-shpinata-57092
Вегетарианское блюдо из фасоли и бобов с чили чипотле;черная консервированная  фасоль, белые консервированные бобы, консервированные помидоры, консервированный перец халапеньо, лук, мелко рубленный чеснок, порошок чили, сладкая паприка, сушеная кинза (кориандр), молотый черный перец, перец чипотле;Основные блюда;Европейская кухня;https://eda.ru/recepty/osnovnye-blyuda/vegetarianskoe-blyudo-iz-fasoli-i-bobov-s-chili-chipotle-57605
Азу по-татарски;говядина, репчатый лук, соленые огурцы, томатная паста , картофель, мясной бульон, чеснок;Основные блюда;Татарская кухня;https://eda.ru/recepty/osnovnye-blyuda/azu-po-tatarski-21751
Картофель «Айдахо»;молодой картофель, оливковое масло extra virgin, укроп, петрушка, чеснок, tabasco® оригинальный красный, соль;Основные блюда;Американская кухня;https://eda.ru/recepty/osnovnye-blyuda/kartofel-ajdaho-30625
Домашний рататуй;баклажаны, желтый сладкий перец, красный сладкий перец, репчатый лук, чеснок, помидоры, сахар, оливковое масло, томатная паста , петрушка, соль, молотый черный перец;Основные блюда;Французская кухня;https://eda.ru/recepty/osnovnye-blyuda/ratatuj-32534
Курица «Пикассо»;куриная грудка, лук, сладкий перец, чеснок, помидоры, овощной бульонный кубик , сыр, смесь итальянских трав, вода, сливки, оливковое масло, мускатный орех, соль, сливочное масло, молотый черный перец;Основные блюда;Испанская кухня;https://eda.ru/recepty/osnovnye-blyuda/kurica-pikasso-25902
Гратен дофинуа;картофель, молоко, сливки 33%-ные, мускатный орех, сыр грюйер, чеснок, соль, молотый черный перец;Основные блюда;Французская кухня;https://eda.ru/recepty/osnovnye-blyuda/graten-dofinua-17587
Треска с помидорами;филе трески, оливковое масло, лимон, петрушка, помидоры черри, соль, молотый черный перец;Основные блюда;Средиземноморская кухня;https://eda.ru/recepty/osnovnye-blyuda/treska-s-pomidorami-17591
Тушеная капуста;репчатый лук, белокочанная капуста, уксус, сахар, пшеничная мука, томатная паста , вода, растительное масло, молотый кумин (зира) , молотый кориандр , соль, молотый черный перец;Основные блюда;Русская кухня;https://eda.ru/recepty/osnovnye-blyuda/tushenaya-kapusta-17323
Хек в зеленом чесночном соусе;хек, чеснок, рубленая петрушка, свежий лавровый лист, оливковое масло extra virgin;Основные блюда;Испанская кухня;https://eda.ru/recepty/osnovnye-blyuda/hek-v-zelenom-chesnochnom-souse-27049
Тушеная свинина;петрушка, укроп, молотый черный перец, соль, чеснок, сметана, ржаная мука, репчатый лук, томатная паста , растительное масло, свинина;Основные блюда;Европейская кухня;https://eda.ru/recepty/osnovnye-blyuda/tushenaya-svinina-16691
Лапша с тыквой и грибами;паста феттучини, тыква, шампиньоны, куриный бульон, сливочное масло, чеснок, сметана, растительное масло, сыр пармезан, петрушка, соль, молотый черный перец;Основные блюда;Китайская кухня;https://eda.ru/recepty/osnovnye-blyuda/lapsha-s-tikvoj-gribami-18595
Тушеная говядина;говядина, репчатый лук, морковь, душистый перец горошком, лавровый лист, паприка, молотый перец чили, соль, молотый черный перец, растительное масло;Основные блюда;Европейская кухня;https://eda.ru/recepty/osnovnye-blyuda/tushenaya-govyadina-40151
Котлеты морковные;морковь, молоко, манная крупа, панировочные сухари, куриное яйцо, сахар, растительное масло;Основные блюда;Европейская кухня;https://eda.ru/recepty/osnovnye-blyuda/kotleti-morkovnie-14903
Говядина по-бургундски;говядина, красное сухое вино, чеснок, репчатый лук, петрушка, тимьян, лавровый лист, черный перец горошком, бекон, сливочное масло, оливковое масло, пшеничная мука, растительное масло, морковь, лук-шалот, шампиньоны, соль, молотый черный перец;Основные блюда;Французская кухня;https://eda.ru/recepty/osnovnye-blyuda/govjadina-po-burgundski-19282
Паэлья с креветками и курицей;круглый рис, чеснок, репчатый лук, сладкий перец, зеленый горошек, креветки, куриные бедра, куриный бульон, черный перец горошком, помидоры, лимон, шафран, оливковое масло, петрушка, соль, молотый черный перец, белое сухое вино;Основные блюда;Итальянская кухня;https://eda.ru/recepty/osnovnye-blyuda/pajelja-s-krevetkami-kuricej-17276
Куриная печень в сметане;куриная печень, сметана 20%-ная, репчатый лук, сливочное масло, соль, молотый черный перец;Основные блюда;Русская кухня;https://eda.ru/recepty/osnovnye-blyuda/kurinaya-pechen-v-smetane-31593
Хинкали;пшеничная мука, вода, соль, телятина, говядина, сало, репчатый лук, чеснок, молотый кумин (зира) , красный перец чили, кинза;Основные блюда;Грузинская кухня;https://eda.ru/recepty/osnovnye-blyuda/hinkali-26016
Котлеты «Фифти-фифти»;куриное филе, репчатый лук, батон, молоко, зеленый лук-резанец , укроп, петрушка, кинза, растительное масло, соль, молотый черный перец;Основные блюда;Одесская кухня;https://eda.ru/recepty/osnovnye-blyuda/kotleti-fifti-fifti-46969
Ферганский плов;рис девзира, баранина на кости, курдючное сало, крупная соль, чеснок, желтая морковь, репчатый лук, молотый кумин (зира) , перец чили;Основные блюда;Узбекская кухня;https://eda.ru/recepty/osnovnye-blyuda/ferganskiy-plov-27690
Картофель, запеченный в мундире;картофель, чеснок, сливочное масло, сметана, бекон, укроп, твердый сыр, зеленый лук, соль, свежемолотый черный перец;Основные блюда;Французская кухня;https://eda.ru/recepty/osnovnye-blyuda/kartofel-zapechennij-v-mundire-23962
Бефстроганов;белые грибы, сметана 30%-ная, сливки 35%-ные, говяжья вырезка, говяжий бульон, белое сухое вино, соль, растительное масло, дижонская горчица, молотый черный перец;Основные блюда;Русская кухня;https://eda.ru/recepty/osnovnye-blyuda/befstroganov-33435
Курица в кисло-сладком соусе по-китайски;куриное филе, соевый соус, яблочный уксус, сахар, вода, томатная паста , сладкий перец, консервированный ананас, помидоры;Основные блюда;Китайская кухня;https://eda.ru/recepty/osnovnye-blyuda/kurica-v-kislo-sladkom-souse-po-kitajski-14456
Чахохбили с курицей и картофелем;помидоры, курица, томатная паста , репчатый лук, чеснок, хмели-сунели, молотый кориандр , шафран, сливочное масло, соль, растительное масло, молотый красный перец, лимон, картофель, свежий красный перец;Основные блюда;Грузинская кухня;https://eda.ru/recepty/osnovnye-blyuda/chahohbili-iz-kurici-17444
Картофельное пюре;картофель, крупная соль, сливочное масло, жирное молоко, соль, молотый черный перец;Основные блюда;Французская кухня;https://eda.ru/recepty/osnovnye-blyuda/kartofelnoe-pjure-29188
Котлеты по-киевски;куриное филе, панировочные сухари панко, чеснок, куриное яйцо, сливки 33%-ные, сливочное масло, петрушка, растительное масло, зеленый лук, эстрагон, соль, молотый черный перец;Основные блюда;Украинская кухня;https://eda.ru/recepty/osnovnye-blyuda/kotleti-po-kievski-33378
Традиционный чили кон карне;говяжий фарш, репчатый лук, красный сладкий перец, перец чили, говяжий бульон, измельченные помидоры в собственном соку , красная консервированная фасоль, кумин (зира), молотый перец чили, паприка, майоран, сахар, чеснок, молотый черный перец, соль, томатная паста ;Основные блюда;Мексиканская кухня;https://eda.ru/recepty/osnovnye-blyuda/tradicionnyy-chili-kon-karne-81227
Гуляш из говядины;репчатый лук, паприка, говяжьи голяшки, чеснок, томатная паста , молотый кумин (зира) , бальзамический уксус, майоран, растительное масло, пшеничная мука, красное сухое вино, лимон, лавровый лист, соль, молотый черный перец;Основные блюда;Венгерская кухня;https://eda.ru/recepty/osnovnye-blyuda/guljash-iz-govjadini-19278
Говядина с устричным соусом;свежая кинза (кориандр), репчатый лук, говяжье филе, капуста брокколи, корень имбиря, лимон, растительное масло, устричный соус;Основные блюда;Китайская кухня;https://eda.ru/recepty/osnovnye-blyuda/govjadina-s-ustrichnim-sousom-36638
Курица, запеченная в хрустящей корочке, с имбирем и апельсинами;курица, цветочный мед, апельсины, тертый имбирь, растительное масло, специи, крупная соль, молотый красный перец;Основные блюда;Испанская кухня;https://eda.ru/recepty/osnovnye-blyuda/kurica-zapechennaja-v-hrustjaschej-korochke-s-imbirem-apelsinami-30720
Макароны, запеченные с помидорами, под сыром;макароны, чеснок, черный перец горошком, сыр, помидоры, майонез;Основные блюда;Итальянская кухня;https://eda.ru/recepty/osnovnye-blyuda/makaroni-zapechennie-s-pomidorami-pod-sirom-19696
Курица с соусом из йогурта, кунжутных семечек, лимона и чеснока;картофель, чеснок, куриная голень, лимон, сахар, соевый соус, йогурт, белый винный уксус, мед, сливочное масло, оливковое масло, кунжутное масло, кунжутные семечки, тимьян, петрушка, соль, молотый черный перец;Основные блюда;Авторская кухня;https://eda.ru/recepty/osnovnye-blyuda/kurica-s-sousom-iz-jogurta-kunzhutnih-semechek-limona-chesnoka-30677
Жареные куриные сердечки;куриные сердца, репчатый лук, морковь, вода, растительное масло, соль, молотый черный перец, карри-порошок;Основные блюда;Европейская кухня;https://eda.ru/recepty/osnovnye-blyuda/zharenye-kurinye-serdechki-32069
Ленивые голубцы с курицей;куриный бульон, чеснок, лимонная трава, красный лук, лавровый лист, репа, имбирь, рис, черный перец горошком, куриное филе, соевый соус, кинза, тростниковый сахар, растительное масло, рисовый уксус для суши, белокочанная капуста;Основные блюда;Мировая кухня;https://eda.ru/recepty/osnovnye-blyuda/lenivye-golubcy-s-kuricey-16633
Цыпленок с розмарином;куриные окорочка, крупная соль, молотый черный перец, пшеничная мука, оливковое масло extra virgin, белое вино, свежий розмарин , лавровый лист, лимонный сок;Основные блюда;Греческая кухня;https://eda.ru/recepty/osnovnye-blyuda/ciplenok-s-rozmarinom-43538
Телятина с красным перцем и апельсинами в горшочке;телятина, апельсины, стебель сельдерея, красный сладкий перец, кайенский перец, дижонская горчица, корица, сахар, морская соль, молотый черный перец, лимон, растительное масло;Основные блюда;Китайская кухня;https://eda.ru/recepty/osnovnye-blyuda/teljatina-s-krasnim-percem-apelsinami-v-gorshochke-30819
Американские макароны с сыром;паста пипе ригате, куриное яйцо, сливочное масло, пшеничная мука, молоко, горчичный порошок, твердый сыр, соль, молотый черный перец;Основные блюда;Американская кухня;https://eda.ru/recepty/osnovnye-blyuda/amerikanskie-makarony-s-syrom-80535
Баранья нога в мятной панировке;баранья нога, свежая мята, сахар, белый винный уксус, оливковое масло, бальзамический уксус, молотый черный перец, соль, тимьян;Основные блюда;Французская кухня;https://eda.ru/recepty/osnovnye-blyuda/baranja-noga-v-mjatnoj-panirovke-18570
Свинина с овощами, тушеная в сливках;шампиньоны, свиная вырезка, сладкий перец, помидоры, сливки 25%-ные, молотый черный перец, молотый белый перец, оливковое масло;Основные блюда;Русская кухня;https://eda.ru/recepty/osnovnye-blyuda/svinina-s-ovoschami-tushenaja-v-slivkah-31016
Конфи из утиных ножек с пюре;утиные ножки, тимьян, розмарин, молотый черный перец, соль, чеснок, утиный жир, лук-шалот, картофель, сливочное масло;Основные блюда;Французская кухня;https://eda.ru/recepty/osnovnye-blyuda/konfi-iz-utinih-nozhek-s-pjure-24287
Запеченная курица с овощами;курица, красный лук, желтый лук, чеснок, петрушка, морковь, сливочное масло, сельдерей, букет гарни, растительное масло;Основные блюда;Французская кухня;https://eda.ru/recepty/osnovnye-blyuda/zapechennaja-kurica-s-ovoshhami-17672
Котлеты «Валленберг»;телятина, сливки 35%-ные, яичный желток, соль, молотый белый перец, свежемороженая брусника, сахар, картофель, сливочное масло, замороженный зеленый горошек ;Основные блюда;Шведская кухня;https://eda.ru/recepty/osnovnye-blyuda/kotleti-vallenberg-51698
Кордон блю;куриное филе, ветчина, швейцарский сыр, растительное масло, куриное яйцо, пшеничная мука, панировочные сухари, молотый черный перец, соль;Основные блюда;Французская кухня;https://eda.ru/recepty/osnovnye-blyuda/kordon-ble-91879
Гуляш;говядина, репчатый лук, картофель, морковь, чеснок, сладкий перец, помидоры, паприка, петрушка, корень сельдерея, растительное масло, тмин;Основные блюда;Венгерская кухня;https://eda.ru/recepty/osnovnye-blyuda/guljash-49673
Креветки в сливочно-чесночном соусе;сливочное масло, чеснок, креветки, рубленая петрушка, соль, сливки;Основные блюда;Французская кухня;https://eda.ru/recepty/osnovnye-blyuda/krevetki-v-slivochno-chesnochnom-souse-18350
Пельмени с говядиной;тесто для пельменей, говяжья грудинка, репчатый лук, петрушка, сливочное масло, укроп, лавровый лист, черный перец горошком, соль, молотый черный перец;Основные блюда;Русская кухня;https://eda.ru/recepty/osnovnye-blyuda/pelmeni-s-govjadinoj-29886
Перцы фаршированные мясом и рисом;фарш, сладкий перец, рис, морковь, репчатый лук, сметана, томатная паста , соль, подсолнечное масло, молотый черный перец;Основные блюда;Советская кухня;https://eda.ru/recepty/osnovnye-blyuda/percy-farshirovannye-myasom-i-risom-26665
Вареники с картошкой и грибами;тесто для вареников, картофель, репчатый лук, морковь, шампиньоны, растительное масло, сливочное масло, сметана, лавровый лист, специи, соль, молотый черный перец;Основные блюда;Русская кухня;https://eda.ru/recepty/osnovnye-blyuda/vareniki-s-kartoshkoj-i-gribami-41379
Мусака;помидоры в собственном соку, сушеная смородина, оливковое масло extra virgin, кайенский перец, бараний фарш, молотая корица, молотый имбирь, молотая гвоздика, чеснок, репчатый лук, красный сладкий перец, красное вино, растительное масло, баклажаны, картофель, сливочное масло, пшеничная мука, молоко, лавровый лист, молотый мускатный орех, яичный желток, греческий йогурт, соль, тертый сыр пармезан , молотый черный перец;Основные блюда;Греческая кухня;https://eda.ru/recepty/osnovnye-blyuda/musaka-43541
Овощное рагу из кабачков с картофелем;кабачки, репчатый лук, помидоры, морковь, зеленый перец, картофель, чеснок, соль, молотый черный перец, растительное масло;Основные блюда;Русская кухня;https://eda.ru/recepty/osnovnye-blyuda/ovoshhnoe-ragu-iz-kabachkov-s-kartofelem-32616
Тушеные кабачки;кабачки, помидоры, морковь, репчатый лук, сметана, чеснок, укроп, растительное масло, пшеничная мука, соль, молотый черный перец;Основные блюда;Европейская кухня;https://eda.ru/recepty/osnovnye-blyuda/tushenye-kabachki-32275
Омурайсу;репчатый лук, курица, зеленый горошек, вареный жасминовый рис, кетчуп, соевый соус, растительное масло, куриное яйцо, сливки, петрушка, соль;Основные блюда;Японская кухня;https://eda.ru/recepty/osnovnye-blyuda/omuraysu-124983
Запеченный говяжий край;говядина, репчатый лук, морковь, сельдерей, букет гарни, соль, растительное масло, молотый черный перец;Основные блюда;Авторская кухня;https://eda.ru/recepty/osnovnye-blyuda/zapechennij-govjazhij-kraj-17670
