food;ingredients;category;kitchen;food_url
Удон с курицей;лапша удон, куриное филе, сладкий перец, стручковая фасоль, салат пак-чой, мини-кукуруза, ростки сои, растительное масло, соевый соус, устричный соус;Основные блюда;Японская кухня;https://eda.ru/recepty/osnovnye-blyuda/udon-s-kuricej-40769
Джамбалайя;растительное масло, чеснок, репчатый лук, зеленый сладкий перец, стебель сельдерея, колбаски, куриная грудка, консервированные помидоры кусочками, томатное пюре, лавровый лист, куриный бульон, рис, креветки, молотый сушеный лук, молотый сушеный чеснок, сушеный орегано, сушеный базилик, сушеный тимьян, кайенский перец, молотый черный перец, паприка, соль;Основные блюда;Креольская кухня;https://eda.ru/recepty/osnovnye-blyuda/dzhambalayya-136876
Перец фаршированный;зеленый перец, мясо, рис, репчатый лук, соль, молотый черный перец, томатная паста , растительное масло;Основные блюда;Авторская кухня;https://eda.ru/recepty/osnovnye-blyuda/perec-farshirovannij-17057
Перец фаршированный;зеленый перец, мясо, рис, репчатый лук, соль, молотый черный перец, томатная паста , растительное масло;Основные блюда;Авторская кухня;https://eda.ru/recepty/osnovnye-blyuda/perec-farshirovannij-17057
Плов из киноа с грибами;киноа, оливковое масло, чеснок, шампиньоны, петрушка, белый лук, куриный бульон;Основные блюда;Узбекская кухня;https://eda.ru/recepty/osnovnye-blyuda/plov-iz-kinoa-s-gribami-15730
Гречка с мясом и томатами по-купечески;репчатый лук, мясной фарш, чеснок, морковь, растительное масло, гречневая крупа, томатная паста ;Основные блюда;Европейская кухня;https://eda.ru/recepty/osnovnye-blyuda/grechka-s-mjasom-i-tomatami-po-kupecheski-39110
Тигровые креветки с томатами, чесноком и травами по рецепту ресторана «Колбасофф»;белое сухое вино, тигровые креветки, оливковое масло, сливочное масло, помидоры, чеснок, базилик, петрушка, тимьян, лимон, молотый белый перец, морская соль;Основные блюда;Итальянская кухня;https://eda.ru/recepty/osnovnye-blyuda/tigrovie-krevetki-s-tomatami-chesnokom-travami-po-receptu-restorana-kolbasoff-21969
Чили кон карне со стаутом;говядина, морковь, стебель сельдерея, красный лук, красная консервированная фасоль, помидоры конкассе, стаут, шрирача, соль, молотый черный перец;Основные блюда;Мексиканская кухня;https://eda.ru/recepty/osnovnye-blyuda/chili-kon-karne-so-stautom-69211
Куриная отбивная в кляре;куриное филе, пшеничная мука, куриное яйцо (крупное), чеснок, майонез, карри, соль, молотый черный перец;Основные блюда;Австрийская кухня;https://eda.ru/recepty/osnovnye-blyuda/kurinaja-otbivnaja-v-kljare-25055
Фиш-энд-чипс в пивном кляре;филе трески, картофель, темный эль, пшеничная мука, сахар, сухие дрожжи, соль, растительное масло;Основные блюда;Британская кухня;https://eda.ru/recepty/osnovnye-blyuda/fish-end-chips-v-pivnom-klyare-81319
Перловая каша с маслом;перловая крупа, соль, сливочное масло;Основные блюда;Русская кухня;https://eda.ru/recepty/osnovnye-blyuda/perlovaya-kasha-s-maslom-15096
Пад-тай с курицей;рыбный соус, тростниковый сахар, паста тамаринда, чеснок, рисовая лапша, растительное масло, красный лук, куриное филе, куриное яйцо, зеленый лук, ростки сои, листья кинзы (кориандра), жареный арахис, лайм, соль;Основные блюда;Тайская кухня;https://eda.ru/recepty/osnovnye-blyuda/pad-tay-93341
Цветная капуста и брокколи, запеченные под сливочным соусом;цветная капуста, капуста брокколи, сливочное масло, пшеничная мука, сливки 10%-ные, сыр, соль, молотый черный перец;Основные блюда;Европейская кухня;https://eda.ru/recepty/osnovnye-blyuda/cvetnaja-kapusta-brokkoli-zapechennie-pod-slivochnim-sousom-18288
Запеченный лосось с брокколи;лосось, капуста брокколи, лимонный сок, сливочное масло, твердый сыр, молоко, сливки, куриное яйцо, молотый мускатный орех;Основные блюда;Французская кухня;https://eda.ru/recepty/osnovnye-blyuda/zapechennij-losos-s-brokkoli-20027
Форель в соево-медовом маринаде;соевый соус, цветочный мед, оливковое масло, чеснок, молотый перец чили, молотый черный перец, белые кунжутные семечки , форель;Основные блюда;Европейская кухня;https://eda.ru/recepty/osnovnye-blyuda/forel-v-soevo-medovom-marinade-38781
Гречка по-купечески;гречневая крупа, свинина, репчатый лук, морковь, чеснок, томатная паста , вода, растительное масло, петрушка, укроп, молотый черный перец, соль, лавровый лист;Основные блюда;Русская кухня;https://eda.ru/recepty/osnovnye-blyuda/grechka-po-kupecheski-140266
Цеппелины;картофель, свиной фарш, репчатый лук, картофельный крахмал, бекон, сметана, соль, молотый черный перец, куриное яйцо, лимонный сок;Основные блюда;Литовская кухня;https://eda.ru/recepty/osnovnye-blyuda/ceppeliny-94091
Пад-тай с курицей;рыбный соус, тростниковый сахар, паста тамаринда, чеснок, рисовая лапша, растительное масло, красный лук, куриное филе, куриное яйцо, зеленый лук, ростки сои, листья кинзы (кориандра), жареный арахис, лайм, соль;Основные блюда;Тайская кухня;https://eda.ru/recepty/osnovnye-blyuda/pad-tay-93341
Запеченный лосось с брокколи;лосось, капуста брокколи, лимонный сок, сливочное масло, твердый сыр, молоко, сливки, куриное яйцо, молотый мускатный орех;Основные блюда;Французская кухня;https://eda.ru/recepty/osnovnye-blyuda/zapechennij-losos-s-brokkoli-20027
Форель в соево-медовом маринаде;соевый соус, цветочный мед, оливковое масло, чеснок, молотый перец чили, молотый черный перец, белые кунжутные семечки , форель;Основные блюда;Европейская кухня;https://eda.ru/recepty/osnovnye-blyuda/forel-v-soevo-medovom-marinade-38781
Колканнон;картофель, капуста кейл, зеленый лук, сливочное масло, соль, молотый черный перец;Основные блюда;Ирландская кухня;https://eda.ru/recepty/osnovnye-blyuda/kolkannon-94090
Техасский хэш;говяжий фарш, репчатый лук, стебель сельдерея, томатный соус пассата, зеленый сладкий перец, рис, чеснок, молотый перец чили, петрушка, помидоры, молотый черный перец, соль;Основные блюда;Американская кухня;https://eda.ru/recepty/osnovnye-blyuda/tehasskiy-hesh-114728
Навага, тушенная в сметане;навага, репчатый лук, морковь, пшеничная мука, сметана 15%-ная, растительное масло, соль, молотый черный перец;Основные блюда;Европейская кухня;https://eda.ru/recepty/osnovnye-blyuda/navaga-tushennaya-v-smetane-69212
Картофельная запеканка с мясом и грибами;репчатый лук, растительное масло, томатный соус, говяжий фарш, консервированный зеленый горошек, консервированная кукуруза, морковь, картофель, молоко, сливочное масло, сметана, соль, молотый черный перец, свежие грибы, рубленая петрушка;Основные блюда;Американская кухня;https://eda.ru/recepty/osnovnye-blyuda/kartofelnaja-zapekanka-s-mjasom-gribami-19168
Курица карри;растительное масло, репчатый лук, куриное филе, желтая паста карри , мини-картофель , кокосовые сливки, рыбный соус, коричневый сахар, соль, кинза, жасминовый рис;Основные блюда;Тайская кухня;https://eda.ru/recepty/osnovnye-blyuda/zheltyy-karri-137247
Кучмачи;говяжье сердце, говяжьи легкие, говяжий рубец, репчатый лук, кинза, томатная паста , зерна граната, уцхо-сунели, молотый кориандр , перец чили, чабрец, чеснок, соль, растительное масло;Основные блюда;Грузинская кухня;https://eda.ru/recepty/osnovnye-blyuda/kuchmachi-47838
Индейка, запеченная с картофелем;голень индейки, картофель, оливковое масло, красный лук, чеснок, сушеный базилик, розмарин, молотый черный перец, морская соль, чернослив;Основные блюда;Американская кухня;https://eda.ru/recepty/osnovnye-blyuda/indejka-zapechennaja-s-kartofelem-20813
Сырные палочки в панировке;твердый сыр, куриное яйцо, пшеничная мука, панировочные сухари, растительное масло;Основные блюда;Американская кухня;https://eda.ru/recepty/osnovnye-blyuda/sirnie-palochki-v-panirovke-23178
Славинк;говяжий фарш, свиной фарш, хлебные крошки, куриное яйцо, бекон, сливочное масло, соль, молотый черный перец, мускатный орех, молоко;Основные блюда;Голландская кухня;https://eda.ru/recepty/osnovnye-blyuda/slavink-114339
Треска с картофельным пюре и соусом из чеснока;филе трески, нут, молоко, мед, тимьян, картофель, морская соль, чеснок, соленые лимоны, молодая морковь, корейский черный чеснок, сливки, растительное масло, сливочное масло, черемша, бородинский хлеб, соль, молотый черный перец;Основные блюда;Европейская кухня;https://eda.ru/recepty/osnovnye-blyuda/treska-s-kartofelnym-pyure-i-sousom-iz-chesnoka-93125
Стейк из тунца с гарниром из брюссельской капусты;брюссельская капуста, тунец, оливковое масло, кунжутное масло, соевый соус, лимонный сок, молотый мускатный орех, мелко рубленный чеснок, сливочное масло, молотый черный перец, соль;Основные блюда;Шведская кухня;https://eda.ru/recepty/osnovnye-blyuda/stejk-iz-tunca-s-garnirom-iz-brjusselskoj-kapusti-30378
Запеченная оленина семьи Баратеон;оленина на косточке, белое сухое вино, растительное масло, дижонская горчица, чеснок, бальзамический уксус, молотый белый перец, орегано, молотый сушеный чеснок, сушеный базилик, молотый кайенский  перец, семена сельдерея, паприка, соль;Основные блюда;Кухня Вестероса;https://eda.ru/recepty/osnovnye-blyuda/zapechennaya-olenina-semi-barateon-69008
Кучмачи;говяжье сердце, говяжьи легкие, говяжий рубец, репчатый лук, кинза, томатная паста , зерна граната, уцхо-сунели, молотый кориандр , перец чили, чабрец, чеснок, соль, растительное масло;Основные блюда;Грузинская кухня;https://eda.ru/recepty/osnovnye-blyuda/kuchmachi-47838
Треска с картофельным пюре и соусом из чеснока;филе трески, нут, молоко, мед, тимьян, картофель, морская соль, чеснок, соленые лимоны, молодая морковь, корейский черный чеснок, сливки, растительное масло, сливочное масло, черемша, бородинский хлеб, соль, молотый черный перец;Основные блюда;Европейская кухня;https://eda.ru/recepty/osnovnye-blyuda/treska-s-kartofelnym-pyure-i-sousom-iz-chesnoka-93125
Филе курицы с грибами под сметаной с сыром;куриное филе, свежие шампиньоны, репчатый лук, сыр, сметана 20%-ная, подсолнечное масло, соль, молотый черный перец;Основные блюда;Французская кухня;https://eda.ru/recepty/osnovnye-blyuda/file-kurici-s-gribami-pod-smetanoj-s-sirom-18906
Пад-капао;филе куриного бедра, устричный соус, соевый соус, тростниковый сахар, растительное масло, чеснок, тайский острый перец птичий глаз, куриное яйцо, базилик;Основные блюда;Тайская кухня;https://eda.ru/recepty/osnovnye-blyuda/pad-kapao-125397
Сливочный шпинат;свежие листья шпината, чеснок, оливковое масло, сливки 33%-ные, соль, молотый черный перец;Основные блюда;Французская кухня;https://eda.ru/recepty/osnovnye-blyuda/slivochnij-shpinat-32524
Свинина в апельсиновой глазури;свинина, апельсины, соевый соус, тертый имбирь, мед;Основные блюда;Тайская кухня;https://eda.ru/recepty/osnovnye-blyuda/svinina-v-apelsinovoj-glazuri-29891
Тальята-ди-манзо;говяжий рибай, розмарин, оливковое масло, рукола, сыр пармезан, соль, молотый черный перец;Основные блюда;Итальянская кухня;https://eda.ru/recepty/osnovnye-blyuda/talyata-di-manzo-125184
Индейка с овощами, кунжутом и соусом терияки;филе индейки, сладкий перец, репчатый лук, чеснок, соус терияки, кунжутные семечки, мед, оливковое масло;Основные блюда;Японская кухня;https://eda.ru/recepty/osnovnye-blyuda/indejka-s-ovoshhami-kunzhutom-i-sousom-terijaki-37771
Свиная вырезка с овощами и лапшой рамен;лапша рамен, свиная вырезка, репчатый лук, зеленая стручковая фасоль, капуста брокколи, сладкий перец, соевый соус, молотый черный перец, растительное масло, соль;Основные блюда;Китайская кухня;https://eda.ru/recepty/osnovnye-blyuda/svinaja-virezka-s-ovoschami-lapshoj-ramen-20520
Цыпленок с розмарином и белым вином;куриные ножки, соль, молотый черный перец, пшеничная мука, оливковое масло extra virgin, белое вино, свежий розмарин , лавровый лист;Основные блюда;Европейская кухня;https://eda.ru/recepty/osnovnye-blyuda/cyplenok-s-rozmarinom-i-belym-vinom-42991
Сациви;индейка, грецкие орехи, репчатый лук, имеретинский шафран, молотый кориандр , молотый черный перец, молотая гвоздика, кинза, белый винный уксус, чеснок, соль;Основные блюда;Грузинская кухня;https://eda.ru/recepty/osnovnye-blyuda/sacivi-126527
Мясные тефтели в томатном соусе;морковь, мясной фарш, лук, рис, лавровый лист, томатная паста , черный перец горошком, молотый кориандр , сахар, пшеничная мука, соль;Основные блюда;Шведская кухня;https://eda.ru/recepty/osnovnye-blyuda/mjasnie-tefteli-v-tomatnom-souse-40942
Мильфей из индейки;филе бедра индейки, молодая капуста, булгур, репчатый лук, белый хлеб, сливки 22%-ные, белые грибы, шампиньоны, белый лук, грибной бульон, куриное яйцо, розовый перец, соль;Основные блюда;Европейская кухня;https://eda.ru/recepty/osnovnye-blyuda/milfey-iz-indeyki-79912
Семипрестольный молочный поросенок;поросенок, свежий розмарин , апельсины, оливковое масло, крупная морская соль, сахар, сливочное масло, красный лук, телячьи почки, петрушка, дижонская горчица, чеснок, белый хлеб для тостов , мускат, свекла, брюссельская капуста, сливочный хрен, перец чили;Основные блюда;Кухня Вестероса;https://eda.ru/recepty/osnovnye-blyuda/semiprestolnyy-molochnyy-porosenok-40742
Мильфей из индейки;филе бедра индейки, молодая капуста, булгур, репчатый лук, белый хлеб, сливки 22%-ные, белые грибы, шампиньоны, белый лук, грибной бульон, куриное яйцо, розовый перец, соль;Основные блюда;Европейская кухня;https://eda.ru/recepty/osnovnye-blyuda/milfey-iz-indeyki-79912
Сибас, запеченный в фольге;сибас, лимон, оливковое масло extra virgin, соль;Основные блюда;Испанская кухня;https://eda.ru/recepty/osnovnye-blyuda/sibas-zapechennij-v-folge-27045
Куриная грудка в сметанном соусе;репчатый лук, куриное филе, сметана, соль, растительное масло, куриный бульонный кубик ;Основные блюда;Итальянская кухня;https://eda.ru/recepty/osnovnye-blyuda/kurinaja-grudka-v-smetannom-souse-14467
Котлеты мясные;фарш, репчатый лук, куриное яйцо, соль, молотый черный перец, белый хлебный мякиш, зелень, растительное масло;Основные блюда;Русская кухня;https://eda.ru/recepty/osnovnye-blyuda/kotleti-mjasnie-31020
Печеные овощи по-простому;баклажаны, кабачки, помидоры, чеснок, огурцы, сушеный орегано, базилик, оливковое масло, куркума;Основные блюда;Мексиканская кухня;https://eda.ru/recepty/osnovnye-blyuda/pechenie-ovoschi-po-prostomu-24049
Печень по-строгановски;говяжья печень, сметана, лук;Основные блюда;Европейская кухня;https://eda.ru/recepty/osnovnye-blyuda/pechen-po-stroganovski-31694
Утка в апельсиновом соусе (Canard à l’Orange);соль, утиная грудка, молотый черный перец, сахар, белое сухое вино, апельсины, куриный бульон, соевый соус;Основные блюда;Французская кухня;https://eda.ru/recepty/osnovnye-blyuda/utka-v-apelsinovom-souse-canard-224-l-orange-25148
Запеченные перепелки;анис (бадьян), оливковое масло, перепелка, паприка, корица, кардамон, мед, чеснок, марокканская смесь специй, молотый черный перец, сушеная вишня, лимон;Основные блюда;Французская кухня;https://eda.ru/recepty/osnovnye-blyuda/zapechennie-perepelki-17671
Бефстроганов из говяжьей вырезки;репчатый лук, сливки 38%-ные, сметана, говяжья вырезка;Основные блюда;Русская кухня;https://eda.ru/recepty/osnovnye-blyuda/befstroganov-iz-govjazhej-virezki-29581
Домашние куриные наггетсы;куриное яйцо, куриное филе, пшеничная мука, соль, молотый черный перец, растительное масло, панировочные сухари;Основные блюда;Американская кухня;https://eda.ru/recepty/osnovnye-blyuda/domashnie-kurinie-naggetsi-35017
Бирьяни;чеснок, имбирь, сушеный перец чили, семена зиры, кардамон, мускатный орех, натуральный йогурт, баранина, топленое масло, репчатый лук, лавровый лист, рис басмати, соль;Основные блюда;Индийская кухня;https://eda.ru/recepty/osnovnye-blyuda/biryani-93343
Свинина запеченная под шубой из перцев и помидор;картофель, свинина, сладкий перец, помидоры, репчатый лук, растительное масло, сыр, майонез;Основные блюда;Русская кухня;https://eda.ru/recepty/osnovnye-blyuda/svinina-zapechennaja-pod-shuboj-iz-percev-pomidor-16539
Венский шницель;огузок говяжий, пшеничная мука, куриное яйцо, панировочные сухари, сливочное масло, молотый черный перец, соль, лимон;Основные блюда;Австрийская кухня;https://eda.ru/recepty/osnovnye-blyuda/venskiy-shnicel-93442
