food;ingredients;category;kitchen;food_url
Широкая рисовая лапша с тыквенным карри;рисовая лапша, тыква, красная паста карри , кокосовое молоко, соевый соус, лайм, растительное масло, кинза, тростниковый сахар, кунжутные семечки, имбирь, кунжутное масло;Основные блюда;Индийская кухня;https://eda.ru/recepty/osnovnye-blyuda/shirokaja-risovaja-lapsha-s-tikvennim-karri-20225
Рататуй-гусеница;баклажаны, сладкий перец, молодые кабачки, помидоры, репчатый лук, морская соль, молотый черный перец, винный уксус, картофель, бальзамический уксус;Основные блюда;Армянская кухня;https://eda.ru/recepty/osnovnye-blyuda/ratatuj-gusenica-35812
Свинина с персиками в соевом соусе со специями;свинина, консервированные персики, репчатый лук, морковь, томатный сок, винный уксус, крахмал, молотый кориандр , молотый сушеный чеснок, молотый имбирь, молотая паприка, сахар, перец чили, кунжут, соль, сладкий перец, соевый соус;Основные блюда;Европейская кухня;https://eda.ru/recepty/osnovnye-blyuda/svinina-s-persikami-v-soevom-souse-so-specijami-41970
Дорада в духовке с помидорами и каперсами;дорада, помидоры, каперсы, петрушка, оливковое масло, растительное масло, чеснок, сливочное масло, белое сухое вино, бульон, соль;Основные блюда;Средиземноморская кухня;https://eda.ru/recepty/osnovnye-blyuda/dorada-v-duhovke-s-pomidorami-i-kapersami-153081
Мясо с подливкой;говядина, репчатый лук, вода, растительное масло, сливочное масло, пшеничная мука, томатная паста , лавровый лист, черный перец горошком, соль, молотый черный перец, сахар;Основные блюда;Советская кухня;https://eda.ru/recepty/osnovnye-blyuda/myaso-s-podlivkoy-151792
Кролик, тушеный в сметане с луком;репчатый лук, кролик, сметана, свежемолотый черный перец, соль, орегано, оливковое масло;Основные блюда;Русская кухня;https://eda.ru/recepty/osnovnye-blyuda/krolik-tushenij-v-smetane-s-lukom-22767
Стейк из свинины;свиная шея, растительное масло, сливочное масло, розмарин, чеснок, соль, молотый черный перец;Основные блюда;Американская кухня;https://eda.ru/recepty/osnovnye-blyuda/steyk-iz-svininy-151670
Фориколь;ребра ягненка, баранья лопатка, мини-картофель , растительное масло, белокочанная капуста, яблочный уксус, черный перец горошком, лавровый лист, пшеничная мука, соль, молотый черный перец;Основные блюда;Европейская кухня;https://eda.ru/recepty/osnovnye-blyuda/forikol-126127
Стейк с морковным пюре и чатни из крыжовника;молодая морковь, сливки 33%-ные, говяжий стейк, сливочное масло, растительное масло, лук-шалот, красный перец чили, крыжовник, чеснок, щавель, кинза, соль, сахар, молотый черный перец;Основные блюда;Пошаговые рецепты;https://eda.ru/recepty/osnovnye-blyuda/steyk-s-morkovnym-pyure-i-chatni-iz-kryzhovnika-125577
Пармиджано из баклажанов;баклажаны, базилик, оливковое масло, сыр моцарелла, тертый сыр пармезан , соль, молотый черный перец, помидоры в собственном соку;Основные блюда;Итальянская кухня;https://eda.ru/recepty/osnovnye-blyuda/parmidzhano-iz-baklazhanov-35602
Голубцы в духовке;белокочанная капуста, фарш, рис, репчатый лук, томатное пюре, сметана, соль, молотый черный перец, зелень, растительное масло;Основные блюда;Русская кухня;https://eda.ru/recepty/osnovnye-blyuda/golubcy-v-duhovke-151698
Пряная форель с огурцом;филе форели, йогурт, чеснок, имбирь, молотый кумин (зира) , растительное масло, кайенский перец, рисовый уксус, оливковое масло, огурцы, кинза;Основные блюда;Европейская кухня;https://eda.ru/recepty/osnovnye-blyuda/prjanaja-forel-s-ogurcom-22046
Картошка в духовке с соусом из авокадо;картофель, авокадо, петрушка, кинза, чеснок, арахис, растительное масло, соль, молотый черный перец;Основные блюда;Латиноамериканская кухня;https://eda.ru/recepty/osnovnye-blyuda/kartoshka-v-duhovke-s-sousom-iz-avokado-173455
Палтус, запеченный в фольге;филе палтуса, молодая морковь, лук-порей, чеснок, лук-шалот, помидоры черри, белое сухое вино, оливковое масло, эстрагон, лавровый лист, розовый перец, молотый черный перец, соль;Основные блюда;Авторская кухня;https://eda.ru/recepty/osnovnye-blyuda/paltus-zapechennij-v-folge-46524
Картофельная запеканка с фаршем;картофель, мясной фарш, сыр пармезан, молоко, репчатый лук, лавровый лист, молотый черный перец, молотый перец чили, паприка, сливочное масло, прованские травы;Основные блюда;Русская кухня;https://eda.ru/recepty/osnovnye-blyuda/kartofelnaja-zapekanka-s-farshem-26035
Гюрза;говядина, баранина, репчатый лук, сладкий перец, бакинские помидоры, шафран, пшеничная мука, кинза, куриное яйцо, укроп, соль, молотый черный перец;Основные блюда;Азербайджанская кухня;https://eda.ru/recepty/osnovnye-blyuda/gjurza-19252
Молодая картошка в духовке;молодой картофель, растительное масло, сливочное масло, чеснок, укроп, соль, молотый черный перец, паприка;Основные блюда;Русская кухня;https://eda.ru/recepty/osnovnye-blyuda/molodaya-kartoshka-v-duhovke-151132
Утка по-пекински;утка, чеснок, сахар, китайская мальтоза, сидр, прованские травы, уксус 9%-ный, соль, смесь «пять перцев»;Основные блюда;Китайская кухня;https://eda.ru/recepty/osnovnye-blyuda/pekinskaja-utka-36759
Курица с сухофруктами;курица, курага, чернослив, миндаль, соль, растительное масло, молотый черный перец;Основные блюда;Азербайджанская кухня;https://eda.ru/recepty/osnovnye-blyuda/kurica-s-suhofruktami-27266
Грузинский чахохбили;свежая кинза (кориандр), репчатый лук, курица, помидоры, сладкий перец, чеснок, петрушка, соль, специи, перец чили;Основные блюда;Грузинская кухня;https://eda.ru/recepty/osnovnye-blyuda/chahohbili-38906
Индейка под соусом «Диана»;грудка индейки, репчатый лук, вешенки, чеснок, сливки 33%-ные, вустерширский соус, коньяк, соль, молотый черный перец, горчица;Основные блюда;Европейская кухня;https://eda.ru/recepty/osnovnye-blyuda/indejka-pod-sousom-diana-31742
Куриные тефтели на пару;репчатый лук, куриное филе, чеснок, петрушка, укроп, молоко, яичный белок, молотый черный перец;Основные блюда;Европейская кухня;https://eda.ru/recepty/osnovnye-blyuda/kurinie-tefteli-na-paru-31337
Крошка-картошка;картофель, репчатый лук, шампиньоны, куриное филе, сметана, растительное масло, сыр, сливочное масло, укроп, лук фри, соль, молотый черный перец;Основные блюда;Турецкая кухня;https://eda.ru/recepty/osnovnye-blyuda/kroshka-kartoshka-140623
Кролик в сметане;ножки кролика, репчатый лук, пшеничная мука, сметана, яблочный уксус, лавровый лист, тимьян, сливочное масло, растительное масло, чеснок, соль, молотый черный перец;Основные блюда;Русская кухня;https://eda.ru/recepty/osnovnye-blyuda/krolik-v-smetane-139936
Овощное рагу с сезонными овощами;кабачки, сладкий перец, баклажаны, соль, молотый черный перец, репчатый лук, растительное масло, чеснок, укроп, помидоры;Основные блюда;Европейская кухня;https://eda.ru/recepty/osnovnye-blyuda/ovoschnoe-ragu-s-sezonnymi-ovoschami-137555
Нежные печеночные оладьи;печень, пшеничная мука, морковь, репчатый лук, куриное яйцо, сметана, соль, сода;Основные блюда;Европейская кухня;https://eda.ru/recepty/osnovnye-blyuda/nezhnie-pechenochnie-oladi-42709
Котлеты из сибаса;репчатый лук, сибас, белый хлеб, яичный желток, яичный белок, сливки, растительное масло, петрушка, сливочное масло, шампиньоны, лук-сибулет, молотый черный перец, соль, икра;Основные блюда;Авторская кухня;https://eda.ru/recepty/osnovnye-blyuda/kotlety-iz-sibasa-152116
Горбуша в духовке;горбуша, лимон, душистый перец горошком, розмарин, оливковое масло, чеснок, соль, молотый черный перец;Основные блюда;Европейская кухня;https://eda.ru/recepty/osnovnye-blyuda/gorbusha-v-duhovke-151619
Лосось в соусе терияки;филе лосося, соевый соус, белое сухое вино, бальзамический уксус, кунжутные семечки, сахарная пудра;Основные блюда;Авторская кухня;https://eda.ru/recepty/osnovnye-blyuda/losos-v-souse-terijaki-14936
Фориколь;ребра ягненка, баранья лопатка, мини-картофель , растительное масло, белокочанная капуста, яблочный уксус, черный перец горошком, лавровый лист, пшеничная мука, соль, молотый черный перец;Основные блюда;Европейская кухня;https://eda.ru/recepty/osnovnye-blyuda/forikol-126127
Стейк с морковным пюре и чатни из крыжовника;молодая морковь, сливки 33%-ные, говяжий стейк, сливочное масло, растительное масло, лук-шалот, красный перец чили, крыжовник, чеснок, щавель, кинза, соль, сахар, молотый черный перец;Основные блюда;Пошаговые рецепты;https://eda.ru/recepty/osnovnye-blyuda/steyk-s-morkovnym-pyure-i-chatni-iz-kryzhovnika-125577
Жареная курица со спаржей и фисташками;кунжутное масло, спаржа, зеленый лук, куриное филе, тертый имбирь, соус чили с чесноком, устричный соус, соленые фисташки;Основные блюда;Европейская кухня;https://eda.ru/recepty/osnovnye-blyuda/zharenaja-kurica-so-sparzhej-fistashkami-27456
Греческая мусака в соусе бешамель;картофель, баклажаны, помидоры, говяжий фарш, репчатый лук, сладкий перец, томатная паста , орегано, твердый сыр, мята, зелень, пшеничная мука, сливочное масло, молоко, куриное яйцо;Основные блюда;Греческая кухня;https://eda.ru/recepty/osnovnye-blyuda/grecheskaja-musaka-v-souse-beshamel-39526
Капуста, тушенная с мясом;подсолнечное масло, молотый черный перец, соль, чеснок, зелень, лавровый лист, томатная паста , репчатый лук, морковь, белокочанная капуста, свинина;Основные блюда;Немецкая кухня;https://eda.ru/recepty/osnovnye-blyuda/kapusta-tushennaja-s-mjasom-16564
Пряная форель с огурцом;филе форели, йогурт, чеснок, имбирь, молотый кумин (зира) , растительное масло, кайенский перец, рисовый уксус, оливковое масло, огурцы, кинза;Основные блюда;Европейская кухня;https://eda.ru/recepty/osnovnye-blyuda/prjanaja-forel-s-ogurcom-22046
Телячья печень с пряной грушей;телячья печень, молоко, груши, палочки корицы, гвоздика, анис (бадьян), белое сухое вино, шафран, сыр пармезан, сливки 30%-ные, соус демигляс, красное сухое вино, пшеничная мука, растительное масло, микросалат, красный лук, уксус, сливочное масло, мед, кардамон, соль, молотый черный перец;Основные блюда;Авторская кухня;https://eda.ru/recepty/osnovnye-blyuda/telyachya-pechen-s-pryanoy-grushey-174363
Картошка с сыром в духовке;картофель, молоко, сливки 33%-ные, тимьян, чеснок, сыр чеддер, сыр моцарелла, соль, молотый черный перец;Основные блюда;Европейская кухня;https://eda.ru/recepty/osnovnye-blyuda/kartoshka-s-syrom-v-duhovke-151511
Рубленые куриные котлеты с укропом;филе куриной грудки, репчатый лук, куриное яйцо, картофельный крахмал, укроп, майонез;Основные блюда;Русская кухня;https://eda.ru/recepty/osnovnye-blyuda/rublenie-kurinie-kotleti-s-ukropom-30570
Шашлык из баранины;баранина, курдючное сало, молотый кориандр , кумин (зира), соль, репчатый лук, сумах;Основные блюда;Узбекская кухня;https://eda.ru/recepty/osnovnye-blyuda/shashlik-iz-baranini-28050
Картошка в духовке с соусом из авокадо;картофель, авокадо, петрушка, кинза, чеснок, арахис, растительное масло, соль, молотый черный перец;Основные блюда;Латиноамериканская кухня;https://eda.ru/recepty/osnovnye-blyuda/kartoshka-v-duhovke-s-sousom-iz-avokado-173455
Телячья печень с пряной грушей;телячья печень, молоко, груши, палочки корицы, гвоздика, анис (бадьян), белое сухое вино, шафран, сыр пармезан, сливки 30%-ные, соус демигляс, красное сухое вино, пшеничная мука, растительное масло, микросалат, красный лук, уксус, сливочное масло, мед, кардамон, соль, молотый черный перец;Основные блюда;Авторская кухня;https://eda.ru/recepty/osnovnye-blyuda/telyachya-pechen-s-pryanoy-grushey-174363
Рубленые куриные котлеты с укропом;филе куриной грудки, репчатый лук, куриное яйцо, картофельный крахмал, укроп, майонез;Основные блюда;Русская кухня;https://eda.ru/recepty/osnovnye-blyuda/rublenie-kurinie-kotleti-s-ukropom-30570
Шашлык из баранины;баранина, курдючное сало, молотый кориандр , кумин (зира), соль, репчатый лук, сумах;Основные блюда;Узбекская кухня;https://eda.ru/recepty/osnovnye-blyuda/shashlik-iz-baranini-28050
Картошка в духовке с соусом из авокадо;картофель, авокадо, петрушка, кинза, чеснок, арахис, растительное масло, соль, молотый черный перец;Основные блюда;Латиноамериканская кухня;https://eda.ru/recepty/osnovnye-blyuda/kartoshka-v-duhovke-s-sousom-iz-avokado-173455
Картофельная запеканка с фаршем;картофель, мясной фарш, сыр пармезан, молоко, репчатый лук, лавровый лист, молотый черный перец, молотый перец чили, паприка, сливочное масло, прованские травы;Основные блюда;Русская кухня;https://eda.ru/recepty/osnovnye-blyuda/kartofelnaja-zapekanka-s-farshem-26035
Яичная лапша с грибами в сливочном соусе;яичная лапша, шампиньоны, сливки 33%-ные, репчатый лук, чеснок, петрушка, тимьян, сливочное масло, растительное масло, соль, молотый черный перец;Основные блюда;Русская кухня;https://eda.ru/recepty/osnovnye-blyuda/yaichnaya-lapsha-s-gribami-v-slivochnom-souse-173477
Картофель со шкварками;картофель, свиное сало, репчатый лук, укроп, соль, молотый черный перец;Основные блюда;Украинская кухня;https://eda.ru/recepty/osnovnye-blyuda/kartofel-so-shkvarkami-21494
Грузинский чахохбили;свежая кинза (кориандр), репчатый лук, курица, помидоры, сладкий перец, чеснок, петрушка, соль, специи, перец чили;Основные блюда;Грузинская кухня;https://eda.ru/recepty/osnovnye-blyuda/chahohbili-38906
Индейка под соусом «Диана»;грудка индейки, репчатый лук, вешенки, чеснок, сливки 33%-ные, вустерширский соус, коньяк, соль, молотый черный перец, горчица;Основные блюда;Европейская кухня;https://eda.ru/recepty/osnovnye-blyuda/indejka-pod-sousom-diana-31742
Яичная лапша с курицей гриль и медовой горчицей;яичная лапша, филе куриного бедра, горчица, мед, майонез, помидоры черри, петрушка, твердый сыр, шпинат, сливочное масло;Основные блюда;Американская кухня;https://eda.ru/recepty/osnovnye-blyuda/yaichnaya-lapsha-s-kuricey-gril-i-medovoy-gorchicey-173478
Красный карри со свиными ребрышками, картошкой и тофу;свиные ребра, картофель, тофу, куриный бульон, лимон, репчатый лук, кокосовое молоко, чеснок, имбирь, кинза, соевый соус, красная паста карри , сахар, растительное масло;Основные блюда;Индийская кухня;https://eda.ru/recepty/osnovnye-blyuda/krasnij-karri-so-svinimi-rebrishkami-kartoshkoj-tofu-15669
Куриные тефтели на пару;репчатый лук, куриное филе, чеснок, петрушка, укроп, молоко, яичный белок, молотый черный перец;Основные блюда;Европейская кухня;https://eda.ru/recepty/osnovnye-blyuda/kurinie-tefteli-na-paru-31337
Ариса;круглозерная пшеница (дзавар), курица, сливочное масло, вода, соль;Основные блюда;Армянская кухня;https://eda.ru/recepty/osnovnye-blyuda/arisa-54874
Скумбрия на мангале с кабачками и лисичками;скумбрия, молодые кабачки, орегано, тимьян, оливковое масло, батат, сливочное масло, молоко, соус терияки, чеснок, лисички, лимонный сок, шпинат, соль, молотый черный перец;Основные блюда;Авторская кухня;https://eda.ru/recepty/osnovnye-blyuda/skumbriya-na-mangale-s-kabachkami-i-lisichkami-174462
Сациви с курагой и хурмой;филе бедра индейки, грудка индейки, куриный бульон, куркума, кинза, грецкие орехи, белый винный уксус, хурма, курага, оливковое масло, чеснок, лимонная цедра, сахар, сладкий херес «педро хименес», репчатый лук, морковь, семена кориандра, тахини, соль, молотый белый перец;Основные блюда;Грузинская кухня;https://eda.ru/recepty/osnovnye-blyuda/sacivi-s-kuragoy-i-hurmoy-91561
Картошка с сыром в духовке;картофель, молоко, сливки 33%-ные, тимьян, чеснок, сыр чеддер, сыр моцарелла, соль, молотый черный перец;Основные блюда;Европейская кухня;https://eda.ru/recepty/osnovnye-blyuda/kartoshka-s-syrom-v-duhovke-151511
Плов с курицей и овощами в мультиварке;куриное филе, длиннозерный рис, лук, морковь, сладкий перец, чеснок, консервированная кукуруза, консервированный зеленый горошек, растительное масло, специи для плова, соль, вода;Основные блюда;Китайская кухня;https://eda.ru/recepty/osnovnye-blyuda/plov-s-kuricej-i-ovoshhami-v-multivarke-42660
Стейк из свинины;свиная шея, растительное масло, сливочное масло, розмарин, чеснок, соль, молотый черный перец;Основные блюда;Американская кухня;https://eda.ru/recepty/osnovnye-blyuda/steyk-iz-svininy-151670
Кюфта из говядины;говяжье филе, репчатый лук, пшеничная мука, куриное яйцо, молоко, коньяк, соль, паприка;Основные блюда;Армянская кухня;https://eda.ru/recepty/osnovnye-blyuda/kyufta-iz-govyadiny-151133
Курица целиком в духовке;курица, чеснок, сушеный базилик, оливковое масло, соль, молотый черный перец, молотая паприка;Основные блюда;Европейская кухня;https://eda.ru/recepty/osnovnye-blyuda/kurica-celikom-v-duhovke-55987
