food;ingredients;category;kitchen;food_url
Теплый сырный сэндвич с печенью;ржаной хлеб, сливочный сыр, сыр эдам, белый сыр чеддер, говяжья печень, помидоры, салат айсберг;Сэндвичи;Низкокалорийная еда;https://eda.ru/recepty/sendvichi/teplij-sirnij-cjendvich-s-pechenju-26339
Гренки с печенью трески, морковью и луком;консервированная печень трески , морковь, лук, майонез, белый хлеб;Сэндвичи;Американская кухня;https://eda.ru/recepty/sendvichi/grenki-s-pechenju-treski-morkovju-i-lukom-43258
Тосты с зеленым луком и кинзой;куриное яйцо, соль, молотый черный перец, зеленый рубленый лук, рубленая кинза (кориандр), белый хлеб, растительное масло;Сэндвичи;Европейская кухня;https://eda.ru/recepty/sendvichi/tosti-s-zelenim-lukom-i-kinzoj-32227
Бургер по-тайски;булочка с кунжутом, говяжий фарш, грибы шиитаке, сыр чеддер для сэндвичей, латук, тертый имбирь, васаби, соевый соус, устричный соус, домашний майонез, жидкий мед, растительное масло, соль, свежемолотый черный перец;Сэндвичи;Паназиатская кухня;https://eda.ru/recepty/sendvichi/burger-po-tajski-54961
Тосты из ржаного хлеба с раковым салатом;раковые шейки, сахар, вустерширский соус, яичный желток, дижонская горчица, растительное масло, лимон, томатная паста , рукола, лук-шалот, соль, ржаные тосты, молотый черный перец;Сэндвичи;Французская кухня;https://eda.ru/recepty/sendvichi/tosti-iz-rzhanogo-hleba-s-rakovim-salatom-26570
Клубный сэндвич;бекон, домашний майонез, хлеб для тостов, пастрома из курицы, помидоры черри, салат романо, сыр чеддер;Сэндвичи;Американская кухня;https://eda.ru/recepty/sendvichi/klubnyy-sendvich-150939
Бейгл с лососем и соусом карри;багель, копченый лосось, морковь, огурцы, смесь салатных листьев, творожный сыр, карри, лимон, жидкий мед, оливковое масло, соль, свежемолотый черный перец;Сэндвичи;Британская кухня;https://eda.ru/recepty/sendvichi/bejgl-s-lososem-i-sousom-karri-54982
Сэндвич «Гондольерчик»;пшеничная булка, огурцы, помидоры, красный лук, зеленый горошек, ветчина, чеснок, твердый сыр, томатный соус, сливочный соус, петрушка, молотый черный перец, крупная соль;Сэндвичи;Турецкая кухня;https://eda.ru/recepty/sendvichi/sjendvich-gondolerchik-40256
«Цезарь»-панини;соус «цезарь», пастрома из курицы, помидоры черри, салат романо, сыр пармезан, чиабатта мини;Сэндвичи;Американская кухня;https://eda.ru/recepty/sendvichi/cezar-panini-150941
Тосты с грибами и тыквой;отрубной хлеб, тыква, свежие грибы, сметана 20%-ная, сахар, пшеничная мука, соль, молотый черный перец, сушеный орегано, оливковое масло;Сэндвичи;Испанская кухня;https://eda.ru/recepty/sendvichi/tosti-s-gribami-tikvoj-25251
Клаб-сэндвич с сыром, беконом и авокадо;бекон, чеснок, майонез, лимонный сок, помидоры, деревенский хлеб, авокадо, швейцарский сыр;Сэндвичи;Американская кухня;https://eda.ru/recepty/sendvichi/klab-sendvich-s-syrom-bekonom-i-avokado-19770
Горячий бутерброд с сыром бри и виноградом;белый хлеб, сливочное масло, сыр бри, виноград;Сэндвичи;Французская кухня;https://eda.ru/recepty/sendvichi/gorjachij-buterbrod-s-sirom-bri-vinogradom-19990
Бутерброды со шпротами и соленым огурцом;нарезной батон, шпроты, майонез, соленые огурцы, рубленая петрушка;Сэндвичи;Европейская кухня;https://eda.ru/recepty/sendvichi/buterbrodi-so-shprotami-i-solenim-ogurcom-40334
«Цезарь»-панини;соус «цезарь», пастрома из курицы, помидоры черри, салат романо, сыр пармезан, чиабатта мини;Сэндвичи;Американская кухня;https://eda.ru/recepty/sendvichi/cezar-panini-150941
Панини с овощами на гриле и сыром моцарелла;пшеничная мука, мед, морская соль, свежие дрожжи, оливковое масло, белый лук, баклажаны, цукини, красный сладкий перец, чеснок, свежий тимьян, свежемолотый черный перец, сыр моцарелла;Сэндвичи;Европейская кухня;https://eda.ru/recepty/sendvichi/panini-s-ovoshhami-na-grile-i-sirom-mocarella-39835
Сэндвич с грушей, сыром бри и ветчиной;цельнозерновая булочка , груши, сыр бри, пармская ветчина;Сэндвичи;Французская кухня;https://eda.ru/recepty/sendvichi/sjendvich-s-grushej-sirom-bri-vetchinoj-27561
Бутерброд «Неряха Джо»;сладкий перец, мясной фарш, молотый черный перец, чеснок, минеральная вода, томатная паста , репчатый лук, горчица, растительное масло, булочка, соль, сахар;Сэндвичи;Европейская кухня;https://eda.ru/recepty/sendvichi/buterbrod-nerjaha-dzho-46467
Пита с хумусом из фасоли;белая фасоль, красная фасоль, морковь, репчатый лук, помидоры в собственном соку, лимон, огурцы, помидоры, маслины, оливки, пита, сыр фета, редис, оливковое масло, кумин (зира), кинза, базилик, оливковое масло extra virgin, соль;Сэндвичи;Средиземноморская кухня;https://eda.ru/recepty/sendvichi/pita-s-humusom-iz-fasoli-126040
Тако с нутом;соевый соус, свежевыжатый лимонный сок, молотый перец чили, молотый тмин, соль, молотый черный перец, молотая паприка, молотый сушеный чеснок, молотый сушеный лук, молотый кайенский  перец, сушеный майоран, консервированный нут, рукола, помидоры, тортильи;Сэндвичи;Греческая кухня;https://eda.ru/recepty/sendvichi/tako-s-nutom-50879
Хот-дог в домашних условиях по-новоорлеански;свежая кинза (кориандр), сосиски, чеснок, помидоры черри, майонез, сушеный тимьян, черный перец горошком, растительное масло, булочка для хот-дога, зеленый лук, перец чили, мягкий сыр;Сэндвичи;Американская кухня;https://eda.ru/recepty/sendvichi/hot-dog-v-domashnih-uslovijah-po-novoorleanski-41323
Ролл капрезе;тортильи, вяленые помидоры в масле, песто, рукола, сыр моцарелла, оливковое масло;Сэндвичи;Европейская кухня;https://eda.ru/recepty/sendvichi/roll-kapreze-150940
Тосты с грибами и сыром;свежие грибы, сливочное масло, лимон, подсолнечное масло, пшеничная мука, молоко, тосты, сыр грюйер, соль, молотый черный перец;Сэндвичи;Авторская кухня;https://eda.ru/recepty/sendvichi/tosti-s-gribami-sirom-15767
Сэндвич с яичницей;оливковое масло, французский багет, сливочное масло, куриное яйцо, томатная паста , соль, молотый черный перец;Сэндвичи;Французская кухня;https://eda.ru/recepty/sendvichi/sjendvich-s-jaichnicej-16332
Бутерброд с горчичной селедкой и свеклой;филе сельди, сахар, свекла, репчатый лук, яблочный уксус, красный лук, сливочное масло, ржаной хлеб, зеленый перец горошком в рассоле, душистый перец горошком, кардамон, гвоздика, семена горчицы, лавровый лист, черный перец горошком, сметана, дижонская горчица, белый мелкий сахар, коричневый сахар;Сэндвичи;Открытый бутерброд;https://eda.ru/recepty/sendvichi/buterbrod-s-gorchichnoy-seledkoy-i-svekloy-29872
Клаб-сэндвич с курицей;куриная грудка, хлеб для тостов, помидоры, майонез, соевый соус, куркума, чеснок, свежемолотый черный перец, сыр, зеленый салат;Сэндвичи;Британская кухня;https://eda.ru/recepty/sendvichi/klab-sjendvich-s-kuricej-51796
Сэндвич с семгой и авокадо;французский багет, слабосоленая семга, авокадо;Сэндвичи;Европейская кухня;https://eda.ru/recepty/sendvichi/sjendvich-s-semgoj-avokado-18519
Бурито овощное;фасоль, помидоры, сладкий перец, грибы, зелень, голландский сыр, лук, томатная паста , тортильи, консервированная кукуруза;Сэндвичи;Мексиканская кухня;https://eda.ru/recepty/sendvichi/burito-ovoschnoe-58125
Банановый сэндвич;бананы, белый хлеб, куриное яйцо, молоко, молотая корица, соль, сливочное масло, кленовый сироп, сахарная пудра;Сэндвичи;Итальянская кухня;https://eda.ru/recepty/sendvichi/bananovij-sjendvich-51199
Бутерброд с горчичной селедкой и свеклой;филе сельди, сахар, свекла, репчатый лук, яблочный уксус, красный лук, сливочное масло, ржаной хлеб, зеленый перец горошком в рассоле, душистый перец горошком, кардамон, гвоздика, семена горчицы, лавровый лист, черный перец горошком, сметана, дижонская горчица, белый мелкий сахар, коричневый сахар;Сэндвичи;Открытый бутерброд;https://eda.ru/recepty/sendvichi/buterbrod-s-gorchichnoy-seledkoy-i-svekloy-29872
Бутерброд с сыром и помидором или огурцом;белый хлеб, сливочное масло, сыр, помидоры, зеленый салат, огурцы;Сэндвичи;Русская кухня;https://eda.ru/recepty/sendvichi/buterbrod-s-sirom-pomidorom-ili-ogurcom-14751
Канапе с сыром, помидором и беконом;белый хлеб, сливочное масло, сыр, помидоры, бекон;Сэндвичи;Европейская кухня;https://eda.ru/recepty/sendvichi/kanape-s-sirom-pomidorom-bekonom-15715
Низкокалорийный бургер со сливочным сыром и куриной грудкой;помидоры, сливочный сыр, французская горчица, цельнозерновая булочка , томатный соус, зеленый салат, куриная грудка;Сэндвичи;Европейская кухня;https://eda.ru/recepty/sendvichi/nizkokalorijnij-burger-so-slivochnim-sirom-i-kurinoj-grudkoj-40512
Круассан с говяжьими щеками;круассан, говяжьи щечки, лавровый лист, черный душистый перец, устричный соус, сливочное масло, сливки 30%-ные, морковь, чеснок, зеленый лук, сок лайма, черный дробленый перец, перец зеленый маринованный, оливковое масло, молотый черный перец, соль;Сэндвичи;Европейская кухня;https://eda.ru/recepty/sendvichi/kruassan-s-govyazhimi-schekami-125591
Ролл с ветчиной и сыром;армянский лаваш, сливочный сыр, морковь, белокочанная капуста, ветчина, соль, зеленый салат, помидоры, филе куриной грудки, молотый черный перец;Сэндвичи;Европейская кухня;https://eda.ru/recepty/sendvichi/roll-s-vetchinoj-i-sirom-41800
Сэндвич с тунцом и авокадо;авокадо, консервированный тунец, белый хлеб для тостов , помидоры, морская соль, салат айсберг, свежемолотый черный перец, петрушка, лимонный сок, сладкий красный лук;Сэндвичи;Американская кухня;https://eda.ru/recepty/sendvichi/sjendvich-s-tuncom-i-avokado-42625
Салат «Цезарь» в лаваше;куриное филе, салат романо, тертый сыр пармезан , армянский лаваш, оливковое масло extra virgin, винный уксус, зернистая горчица, куриное яйцо (крупное), соль, свежемолотый черный перец, чеснок, оливковый майонез;Сэндвичи;Русская кухня;https://eda.ru/recepty/sendvichi/salat-cezar-v-lavashe-33466
Бутерброды с баклажаном и моцареллой;баклажаны, белый хлеб, растительное масло, орегано, сыр моцарелла, перец чили, сушеные помидоры, базилик;Сэндвичи;Открытый бутерброд;https://eda.ru/recepty/sendvichi/buterbrodi-s-baklazhanom-mocarelloj-18244
Тост с бычьими хвостами;чиабатта, вешенки, свежие листья шпината, соус бешамель, бычий хвост, оливковое масло extra virgin, соль, молотый черный перец;Сэндвичи;Тосты;https://eda.ru/recepty/sendvichi/tost-s-bychimi-hvostami-56942
Тост с бычьими хвостами;чиабатта, вешенки, свежие листья шпината, соус бешамель, бычий хвост, оливковое масло extra virgin, соль, молотый черный перец;Сэндвичи;Тосты;https://eda.ru/recepty/sendvichi/tost-s-bychimi-hvostami-56942
Горячий бутерброд с сыром бри и яблочным джемом;хлеб, сыр бри, яблочный джем, сливочное масло;Сэндвичи;Американская кухня;https://eda.ru/recepty/sendvichi/goryachiy-buterbrod-s-syrom-bri-i-yablochnym-dzhemom-152797
Бургер с утиными ножками конфи;булочка для гамбургеров, утиные ножки конфи, картофель, листья латука, грецкие орехи, дижонская горчица, домашний майонез, соль, свежемолотый черный перец;Сэндвичи;Гамбургер;https://eda.ru/recepty/sendvichi/burger-s-utinimi-nozhkami-konfi-54981
Шаурма Марка Гельмана;филе куриного бедра, молотый кумин (зира) , куркума, паприка, молотая корица, анис (бадьян), молотый черный перец, молотый сушеный чеснок, растительное масло, тахини, чеснок, лимон, помидоры, огурцы, соленые огурцы, соль, вода;Сэндвичи;Шаурма;https://eda.ru/recepty/sendvichi/shaurma-marka-gelmana-137028
Сэндвич с яичным салатом;куриное яйцо, зеленый лук, огурцы, белый хлеб, плавленый сырок, соль;Сэндвичи;Европейская кухня;https://eda.ru/recepty/sendvichi/sjendvich-s-jaichnim-salatom-32169
Тост с авокадо и шпинатом;шпинат, авокадо, цельнозерновой хлеб, сливочный сыр, лимон, растительное масло, оливковое масло, соль, молотый черный перец;Сэндвичи;Европейская кухня;https://eda.ru/recepty/sendvichi/tost-s-avokado-i-shpinatom-138600
Дважды обжаренный картофель фри;картофель, растительное масло, соль;Сэндвичи;Американская кухня;https://eda.ru/recepty/sendvichi/dvazhdy-obzharennyy-kartofel-fri-45419
Клубный сэндвич с индейкой;панчетта, белый хлеб, зеленый салат, помидоры, шнитт-лук, индейка, рубленая петрушка, куриное яйцо, белый винный уксус, чеснок, дижонская горчица, оливковое масло, соль, молотый черный перец;Сэндвичи;Американская кухня;https://eda.ru/recepty/sendvichi/klubnij-sjendvich-s-indejkoj-18029
Клаб-сэндвич с карбонадом;бекон, карбонад, сыр, красный лук, майонез, хлеб для тостов, помидоры, зеленый салат;Сэндвичи;Европейская кухня;https://eda.ru/recepty/sendvichi/klab-sendvich-39109
Классический филадельфийский сэндвич;говяжий стейк, круглая булочка, сладкий перец, репчатый лук, чеснок, пиво, тимьян, кинза, петрушка, перец чили, сыр раклет, оливковое масло, соль, молотый черный перец;Сэндвичи;Европейская кухня;https://eda.ru/recepty/sendvichi/klassicheskiy-filadelfiyskiy-sendvich-140908
Гамбургеры с грибами портобелло;грибы портобелло, оливковое масло, помидоры, чеснок, перец чили, красный лук, чиабатта, листья латука, трюфельное масло, сыр эмменталь;Сэндвичи;Американская кухня;https://eda.ru/recepty/sendvichi/gamburgeri-s-gribami-portobello-17383
Горячий бутерброд с сыром и чоризо;хлеб, сыр чеддер, чоризо, сливочное масло, брусничный джем;Сэндвичи;Американская кухня;https://eda.ru/recepty/sendvichi/goryachiy-buterbrod-s-syrom-i-chorizo-152795
Бутерброды жареные с камамбером;белый хлеб, сыр камамбер, клюквенный соус, бальзамический уксус;Сэндвичи;Русская кухня;https://eda.ru/recepty/sendvichi/buterbrodi-zharenie-s-kamamberom-14725
Чизбургер из свинины с авокадо и кинзой;чеснок, свиной фарш, сыр, булочка, помидоры, майонез, авокадо, кинза, соль, растительное масло, молотый черный перец;Сэндвичи;Американская кухня;https://eda.ru/recepty/sendvichi/chizburger-iz-svinini-s-avokado-kinzoj-19437
Бутерброд с грушей;белый хлеб, груши, прошутто, сливочный сыр, сыр дорблю, гречишный мед, оливковое масло, ореховая крошка;Сэндвичи;Европейская кухня;https://eda.ru/recepty/sendvichi/buterbrod-s-grushey-152694
Тосты с яичной начинкой;куриное яйцо, соль, белый хлеб для тостов , молотый черный перец, сливочное масло;Сэндвичи;Американская кухня;https://eda.ru/recepty/sendvichi/tosti-s-jaichnoj-nachinkoj-35840
Брускетта с маскарпоне и свежей клубникой;цельнозерновой хлеб, коричневый сахар, тертая лимонная цедра, лимонный сок, клубника, сыр маскарпоне;Сэндвичи;Итальянская кухня;https://eda.ru/recepty/sendvichi/brusketta-s-maskarpone-svezhej-klubnikoj-28169
Сэндвич с крабовым мясом;чиабатта, сливочный сыр, сыр грана-падано, сыр эдам, смесь салатных листьев, помидоры, мясо краба;Сэндвичи;Американская кухня;https://eda.ru/recepty/sendvichi/sjendvich-s-krabovim-mjasom-30531
Горячий бутерброд с тремя сырами;хлеб, сыр чеддер, сыр раклет, сыр бри, сливочное масло;Сэндвичи;Американская кухня;https://eda.ru/recepty/sendvichi/goryachiy-buterbrod-s-tremya-syrami-152794
Сладкие тосты;белый хлеб, молоко, сахар, растительное масло;Сэндвичи;Французская кухня;https://eda.ru/recepty/sendvichi/sladkie-tosti-32574
Тосты с пармезаном, голубым сыром и зеленым луком;чеснок, майонез, свежемолотый черный перец, кайенский перец, голубой сыр, тертый сыр пармезан , французский багет, оливковое масло, зеленый лук;Сэндвичи;Европейская кухня;https://eda.ru/recepty/sendvichi/tosti-s-parmezanom-golubim-sirom-zelenim-lukom-21776
Горячие бутерброды с творогом, соевым соусом и укропом;белый хлеб, сливочное масло, творог, соевый соус, укроп;Сэндвичи;Русская кухня;https://eda.ru/recepty/sendvichi/gorjachie-buterbrodi-s-tvorogom-soevim-sousom-ukropom-14738
Сэндвич с тунцом на ремесленном хлебе;цельнозерновой хлеб, консервированный тунец в масле, японский майонез, чеснок, оливки, соленые огурцы, каперсы, зелень;Сэндвичи;Авторская кухня;https://eda.ru/recepty/sendvichi/sendvich-s-tuncom-na-remeslennom-hlebe-139801
Дакос;ячменный хлеб, помидоры, сыр фета, оливки, оливковое масло, сушеный орегано;Сэндвичи;Европейская кухня;https://eda.ru/recepty/sendvichi/dakos-57008
Брускетта с белыми грибами и рукколой;рукола, сыр пармезан, замороженные белые грибы, оливковое масло, чиабатта;Сэндвичи;Американская кухня;https://eda.ru/recepty/sendvichi/brusketta-s-belimi-gribami-i-rukkoloj-34326
Горячий бутерброд с сыром, халапеньо и анчоусами;хлеб, сыр раклет, консервированный перец халапеньо, анчоусы, сливочное масло;Сэндвичи;Американская кухня;https://eda.ru/recepty/sendvichi/goryachiy-buterbrod-s-syrom-halapeno-i-anchousami-152796
