food;ingredients;category;kitchen;food_url
Тосты с брокколи;капуста брокколи, тосты, растительное масло, куриное яйцо, сыр, сливки, сливочное масло, соль, молотый черный перец;Сэндвичи;Тосты;https://eda.ru/recepty/sendvichi/tosti-s-brokkoli-14729
Закусочные бутерброды с грибами в микроволновой печи;белый хлеб, сыр моцарелла, сливочное масло, шампиньоны, чеснок, молотая паприка, соль, петрушка, укроп;Сэндвичи;Европейская кухня;https://eda.ru/recepty/sendvichi/zakusochnye-buterbrody-s-gribami-v-mikrovolnovoy-pechi-58426
Рулет с овощами;тортильи, красный лук, морковь, сладкий перец, зеленый салат, натуральный обезжиренный йогурт , творожный сыр, горчица, соль, молотый черный перец;Сэндвичи;Индийская кухня;https://eda.ru/recepty/sendvichi/rulet-s-ovoschami-94117
Домашние бургеры с грибами;говяжий фарш, булочка для гамбургеров, помидоры, сыр чеддер, огурцы, репчатый лук, майонез, свежие шампиньоны, горчица, кетчуп, соль, молотый черный перец;Сэндвичи;Американская кухня;https://eda.ru/recepty/sendvichi/domashnie-burgeri-s-gribami-42961
Бутербродики из картофеля с сыром;картофель, белый хлеб, сыр с плесенью, куриное яйцо, оливковое масло;Сэндвичи;Русская кухня;https://eda.ru/recepty/sendvichi/buterbrodiki-iz-kartofelja-s-sirom-52785
Горячие бутерброды на скорую руку;сосиски, помидоры, чеснок, майонез, кетчуп, бородинский хлеб, сыр, зелень, молотый черный перец;Сэндвичи;Русская кухня;https://eda.ru/recepty/sendvichi/goryachie-buterbrody-na-skoruyu-ruku-49594
Бургеры «Хогвартс-экспресс» с дымком;майонез, красный сладкий перец, копченая паприка, молотый перец чили, кайенский перец, говяжий фарш, бекон, сыр гауда, соль, кетчуп, булочка для гамбургеров, сливочное масло, мак, помидоры;Сэндвичи;Британская кухня;https://eda.ru/recepty/sendvichi/burgery-hogvarts-ekspress-s-dymkom-152532
Тосты с ревенем;ревень, белое сухое вино, корица, лимонная цедра, белый хлеб, молоко, сливочное масло;Сэндвичи;Американская кухня;https://eda.ru/recepty/sendvichi/tosti-s-revenem-16391
Сэндвич с ветчиной и сыром «Монте-Кристо»;хлеб для тостов, горчица, майонез, ветчина, сыр грюйер, куриное яйцо, молоко, соль, сливочное масло;Сэндвичи;Европейская кухня;https://eda.ru/recepty/sendvichi/sendvich-s-vetchinoy-i-syrom-monte-kristo-57879
Такос;куриная грудка, зеленый салат, сметана, репчатый лук, российский сыр, лайм, соль, молотый черный перец, молотый красный перец, тортильи, красный сладкий перец;Сэндвичи;Мексиканская кухня;https://eda.ru/recepty/sendvichi/takos-91490
Мини-бургеры с семгой;сухие дрожжи, молоко, пшеничная мука, сливочное масло, сахар, соль, куриное яйцо, чеснок, картофель, лимонный сок, сыр маскарпоне, жирные сливки;Сэндвичи;Европейская кухня;https://eda.ru/recepty/sendvichi/mini-burgery-s-semgoy-58404
Чиабатта с беконом;чиабатта, копченый бекон , копченая корейка, зеленый салат, красный лук, плавленый сыр в нарезке, майонез, горчица, соевый соус;Сэндвичи;Итальянская кухня;https://eda.ru/recepty/sendvichi/chiabatta-s-bekonom-50971
Тосты с чечевицей и сыром;цельнозерновой хлеб, чечевица, мягкий сыр, оливковое масло;Сэндвичи;Европейская кухня;https://eda.ru/recepty/sendvichi/tosti-s-chechevicej-i-sirom-52134
Бургер веганский;тофу, сухие дрожжи, соевый соус, оливковое масло, булочка для гамбургеров, натуральный концентрат ольхового дыма ;Сэндвичи;Веганская еда;https://eda.ru/recepty/sendvichi/burger-veganskiy-56555
Легкий салат на тосте;помидоры, оливковое масло, морская соль, свежемолотый черный перец, бальзамический уксус, хлеб для тостов, чеснок, сушеный орегано, зелень;Сэндвичи;Европейская кухня;https://eda.ru/recepty/sendvichi/legkij-salat-na-toste-39727
Бутерброды со щавелем и снытью;тосты, щавель, сныть, грецкие орехи, куриное яйцо, вода, сахар, соль, растительное масло;Сэндвичи;Открытый бутерброд;https://eda.ru/recepty/sendvichi/buterbrodi-so-schavelem-snitju-14800
Классический гамбургер;растительное масло, говяжий фарш, соль, молотый черный перец, булочка для гамбургеров, помидоры, маринованные огурцы, салат айсберг, репчатый лук;Сэндвичи;Американская кухня;https://eda.ru/recepty/sendvichi/klassicheskij-gamburger-54526
Ржаные булочки с зирой и базиликом;ржаная мука, вода, сухие дрожжи, семена кумина (зира) , базилик;Сэндвичи;Хлеб;https://eda.ru/recepty/sendvichi/rzhanye-bulochki-s-ziroy-i-bazilikom-69084
Бутерброд с помидором и майонезом;помидоры, нарезной батон, майонез;Сэндвичи;Русская кухня;https://eda.ru/recepty/sendvichi/buterbrod-s-pomidorom-i-majonezom-45470
Брускетта с ростбифом и вялеными помидорами;цельнозерновой хлеб, вяленые помидоры, ростбиф, зелень;Сэндвичи;Итальянская кухня;https://eda.ru/recepty/sendvichi/brusketta-s-rostbifom-i-vyalenymi-pomidorami-55774
Сэндвич по-домашнему;докторская колбаса, белый хлеб для тостов , твердый сыр;Сэндвичи;Клубный сэндвич;https://eda.ru/recepty/sendvichi/sjendvich-po-domashnemu-32906
Спилбургер;булочка с кунжутом, помидоры, сладкий перец, помидоры черри, крекеры «tuc», кетчуп, зеленый салат, огурцы, майонез, говяжий миньон;Сэндвичи;Американская кухня;https://eda.ru/recepty/sendvichi/spilburger-43436
Яйца пашот с жареной копченой курицей под голландским соусом;ржаной хлеб, сливочное масло, сыр пармезан, копченая курица, куриное яйцо, лимонный сок, соль, молотый черный перец, петрушка, зеленый лук;Сэндвичи;Французская кухня;https://eda.ru/recepty/sendvichi/yayca-pashot-s-zharenoy-kopchenoy-kuricey-pod-gollandskim-sousom-54686
Сэндвич с яблоком;цельнозерновые хлебцы, сыр гауда, сыр чеддер для сэндвичей, варено-копченая говядина, яблоко;Сэндвичи;Американская кухня;https://eda.ru/recepty/sendvichi/sendvich-s-yablokom-80417
Сэндвич с семгой и рукколой;маленький французский багет, рукола, слабосоленая семга, маринованные огурцы, чеснок, укроп, эстрагон, петрушка, каперсы, зернистая горчица, яичный желток, оливковое масло, лимонный сок, соль, молотый черный перец;Сэндвичи;Европейская кухня;https://eda.ru/recepty/sendvichi/sendvich-s-semgoy-i-rukkoloy-68594
Брускетта с ростбифом;чеснок, оливковое масло, цельнозерновой хлеб, ростбиф, смесь салатных листьев пати микс «белая дача», маринованные огурцы, помидоры, вустерширский соус, соус «винегрет», клюквенный соус, соль, молотый черный перец, сахар, французская горчица, тимьян, клюква, вода;Сэндвичи;Итальянская кухня;https://eda.ru/recepty/sendvichi/brusketta-s-rostbifom-125695
Горячий сэндвич с омлетом из зелени;нарезной батон, куриное яйцо, зелень, сыр, сосиски, специи, растительное масло;Сэндвичи;Закрытый бутерброд;https://eda.ru/recepty/sendvichi/goryachiy-sendvich-s-omletom-iz-zeleni-92242
Кростини с козьим сыром и компотом из инжира;оливковое масло extra virgin, маленький французский багет, коричневый сахар, сушеный инжир, красное сухое вино, крупная соль, измельченный свежий тимьян, мягкий козий сыр;Сэндвичи;Итальянская кухня;https://eda.ru/recepty/sendvichi/krostini-s-kozim-syrom-i-kompotom-iz-inzhira-29956
Тосты с козьим сыром и запеченным в хересном уксусе луком;козий сыр, хересный уксус, испанский лук, черная патока, оливковое масло, кудрявый салат, рукола, чеснок, крупная соль, сухая горчица, молотый черный перец, бальзамический уксус;Сэндвичи;Европейская кухня;https://eda.ru/recepty/sendvichi/tosti-s-kozim-sirom-zapechennim-v-heresnom-uksuse-lukom-18608
Кето-бутерброды с красной рыбой;куриное яйцо, псиллиум, сливочный сыр, слабосоленая красная рыба, смесь салатных листьев;Сэндвичи;Европейская кухня;https://eda.ru/recepty/sendvichi/ketobuterbrody-s-krasnoy-ryboy-140727
Стейк бургер;филейная вырезка, булочка, томатная паста , копченая паприка, бальзамический уксус, соленые огурцы, помидоры, репчатый лук, сыр маасдам, салат романо, растительное масло;Сэндвичи;Европейская кухня;https://eda.ru/recepty/sendvichi/stejk-burger-47780
Барбекю мелт с курицей и беконом;хлеб для тостов, соус барбекю, куриная грудка, бекон, репчатый лук, оливковое масло, соль, сыр чеддер;Сэндвичи;Американская кухня;https://eda.ru/recepty/sendvichi/barbekju-melt-s-kuricej-i-bekonom-46845
Запеченная куриная грудка с перцем в лаваше или пите с луком;сладкий перец, красный лук, сметана 23%-ная, зеленый салат, куриное филе, лайм, орегано, молотая паприка, пита, растительное масло;Сэндвичи;Европейская кухня;https://eda.ru/recepty/sendvichi/zapechennaya-kurinaya-grudka-s-percem-v-lavashe-ili-pite-s-lukom-68602
Студенческий бутерброд с куриной грудкой;куриная грудка, кетчуп, майонез, помидоры, петрушка, зеленый лук, укроп, ржаной хлеб;Сэндвичи;Русская кухня;https://eda.ru/recepty/sendvichi/studencheskiy-buterbrod-s-kurinoy-grudkoy-57630
Тост с авокадо и гуакамоле;белый хлеб, оливковое масло, гуакамоле, перец чили, соль, молотый черный перец, авокадо;Сэндвичи;Мексиканская кухня;https://eda.ru/recepty/sendvichi/tost-s-avokado-i-guakamole-136865
Брускетта с тунцом;свежая кинза (кориандр), цельнозерновой хлеб, филе тунца, сок лайма, перец чили, авокадо, оливковое масло, молотый черный перец;Сэндвичи;Итальянская кухня;https://eda.ru/recepty/sendvichi/brusketta-s-tuncom-55714
Скандинавский многоэтажный мясной бутерброд с вишневым соусом;ржано-пшеничная чиабатта, куриное филе, оливки, свежий эстрагон, тмин, молотый черный перец, соль, лавровый лист, вишня, оливковое масло, бальзамический уксус, мед;Сэндвичи;Европейская кухня;https://eda.ru/recepty/sendvichi/skandinavskij-mnogojetazhnij-mjasnoj-buterbrod-s-vishnevim-sousom-47083
Бутерброды с ветчиной и хреном;хлеб для тостов, сливочное масло, маринованный перец, тертый твердый сыр, копченая ветчина, хрен, майонез;Сэндвичи;Русская кухня;https://eda.ru/recepty/sendvichi/buterbrody-s-vetchinoy-i-hrenom-93052
Сочный бургер с ананасом;говяжий фарш, перец чили хлопьями, чеснок, соль, молотый черный перец, несоленое сливочное масло, репчатый лук, консервированный ананас, оливковое масло extra virgin, белый сыр чеддер, куриное яйцо, булочка для гамбургеров, зеленый салат, маринованная свекла, помидоры;Сэндвичи;Американская кухня;https://eda.ru/recepty/sendvichi/sochnij-burger-s-ananasom-54403
Французские тосты с камамбером;хлеб для тостов, сливки, куриное яйцо, сахарная пудра, корица, сыр камамбер, абрикосовый конфитюр , оливковое масло, сливочное масло;Сэндвичи;Французская кухня;https://eda.ru/recepty/sendvichi/francuzskie-tosti-s-kamamberom-51716
Быстрый горячий бутерброд-пицца;майонез, сыр, белый хлеб, докторская колбаса, помидоры, зеленый лук;Сэндвичи;Европейская кухня;https://eda.ru/recepty/sendvichi/bistrij-gorjachij-buterbrod-picca-37127
Домашние бургеры с рваной курицей и соусом на кефире;растительное масло, куриное яйцо, лимонный сок, сахар, горчица, кефир, зеленый лук, соленые огурцы, куриные бедра, булочка для гамбургеров, зеленый салат, огурцы, помидоры, белый лук, соль;Сэндвичи;Американская кухня;https://eda.ru/recepty/sendvichi/domashnie-burgery-s-rvanoy-kuricey-i-sousom-na-kefire-137420
Ханамаки;разрыхлитель, пшеничная мука, сахар, вода, сухие дрожжи, зеленый лук, растительное масло, соль;Сэндвичи;Авторская кухня;https://eda.ru/recepty/sendvichi/hanamaki-34897
Классический бургер;говяжий фарш, салатный лук, твердый сыр, помидоры, кетчуп, майонез, латук, булочка для гамбургеров, соль, молотый черный перец;Сэндвичи;Американская кухня;https://eda.ru/recepty/sendvichi/klassicheskiy-burger-114799
Сэндвич с яйцами пашот в панировке;куриное яйцо, ветчина из индейки, сыр пармезан, хлеб для тостов, рукола, панировочные сухари, свежий тимьян, сушеный базилик, соль, яблочный уксус;Сэндвичи;Американская кухня;https://eda.ru/recepty/sendvichi/sendvich-s-yaycami-pashot-v-panirovke-92481
Мраморный бургер со стейком из мраморной говядины и соусом из голубого сыра;пшеничная мука высшего сорта, вода, сухие дрожжи, соль, сахар, кунжут, растительное масло, говяжий стейк, авокадо, помидоры, репчатый лук, мягкий голубой сыр, чеснок, бальзамический уксус, натуральный йогурт, сушеный розмарин, оливковое масло, свежемолотый черный перец, специи;Сэндвичи;Американская кухня;https://eda.ru/recepty/sendvichi/mramornyy-burger-so-steykom-iz-mramornoy-govyadiny-i-sousom-iz-golubogo-syra-114315
Гамбургер с котлетой из говядины;говяжий фарш, репчатый лук, чабрец, молотый черный перец, свежий розмарин , сушеная кинза (кориандр), семена фенхеля, кайенский перец, куриное яйцо, утиный жир, соль, булочка для гамбургеров;Сэндвичи;Американская кухня;https://eda.ru/recepty/sendvichi/gamburger-s-kotletoj-iz-govjadini-54392
Бургер «Молчание ягнят»;бриошь, майонез, ягнятина, помидоры, сыр сулугуни, красный лук, соус сальса, кинза, латук;Сэндвичи;Американская кухня;https://eda.ru/recepty/sendvichi/burger-molchanie-yagnyat-93930
Бургер «Молчание ягнят»;бриошь, майонез, ягнятина, помидоры, сыр сулугуни, красный лук, соус сальса, кинза, латук;Сэндвичи;Американская кухня;https://eda.ru/recepty/sendvichi/burger-molchanie-yagnyat-93930
Хрустящие хлебцы с овощным угаром (ХоХ);свежая кинза (кориандр), баклажаны, зеленый перец, помидоры, перец чили, свежий имбирь, цельнозерновой хлеб;Сэндвичи;Европейская кухня;https://eda.ru/recepty/sendvichi/hrustjashhie-hlebci-s-ovoshhnim-ugarom-hoh-40016
Сэндвич с мясом;говяжий фарш, куриный бульон, соль, молотый черный перец, булочка для гамбургеров, репчатый лук;Сэндвичи;Американская кухня;https://eda.ru/recepty/sendvichi/sjendvich-s-mjasom-54431
Диетический кебаб;пшеничные тортильи, курица, мягкий сыр, греческий йогурт, соленые огурцы, репчатый лук, кетчуп;Сэндвичи;Датская кухня;https://eda.ru/recepty/sendvichi/dieticheskiy-kebab-92659
Хруст с печенью трески;сливочное масло, горчица, репчатый лук, рыбный бульон, белое вино, соль, чеснок, тимьян, сахар, белый хлеб, яблоко, лимонный сок, печень трески, лук-сибулет;Сэндвичи;Французская кухня;https://eda.ru/recepty/sendvichi/hrust-s-pechenyu-treski-125470
Сэндвич с луком и помидорами;репчатый лук, помидоры, томатная паста , сливочное масло, горчица, зелень, соль, белый хлеб;Сэндвичи;Европейская кухня;https://eda.ru/recepty/sendvichi/sjendvich-s-lukom-i-pomidorami-40957
Жареный сэндвич с грюйером, луком и чили;белый хлеб для тостов , томатный соус с чили, тертый сыр грюйер , репчатый лук, сливочное масло, тертый сыр пармезан , соль, свежемолотый черный перец;Сэндвичи;Французская кухня;https://eda.ru/recepty/sendvichi/zharenij-sjendvich-s-grjujerom-lukom-i-chili-53808
Острая кесадилья с курицей;куриное филе, репчатый лук, томатная паста , чеснок, молотый кумин (зира) , консервированный перец халапеньо, оливковое масло, соль, молотый черный перец, пшеничные тортильи, гуакамоле, помидоры, сладкая паприка, tabasco® оригинальный красный, сыр моцарелла;Сэндвичи;Мексиканская кухня;https://eda.ru/recepty/sendvichi/ostraja-kesadilja-s-kuricej-43686
Сэндвич с жареным лососем;филе лосося, авокадо, зеленый салат, цельнозерновая булочка , лимон, чеснок, соль, оливковое масло, орегано;Сэндвичи;Американская кухня;https://eda.ru/recepty/sendvichi/sendvich-s-zharenym-lososem-104202
Вегетарианский бургер «Гринпис»;бриошь, нут, соус карри, латук, красный лук, помидоры, маринованные огурцы;Сэндвичи;Арабская кухня;https://eda.ru/recepty/sendvichi/vegetarianskiy-burger-grinpis-93929
Деревенские ароматные ржаные-пшеничные булочки с изюмом, грецкими орехами, злаками;ржаная мука, пшеничная мука, сухие дрожжи, морская соль, сахар, семена кориандра, молотая корица, молотая гвоздика, грецкие орехи, изюм, семена зиры;Сэндвичи;Булочки;https://eda.ru/recepty/sendvichi/derevenskie-aromatnye-rzhanye-pshenichnye-bulochki-s-izyumom-greckimi-orehami-zlakami-69177
Бутерброд с лососем и огурцом;цельнозерновые хлебцы, огурцы, слабосоленый лосось;Сэндвичи;Европейская кухня;https://eda.ru/recepty/sendvichi/buterbrod-s-lososem-i-ogurcom-69302
Тыквенные бургеры;тыква, картофель, куриное яйцо, пшеничная мука, сыр чеддер, помидоры, зеленый салат, соус терияки, булочка для гамбургеров, карри, молотый перец чили;Сэндвичи;Вегетарианская еда;https://eda.ru/recepty/sendvichi/tykvennye-burgery-137046
Стейк бургер по армянски;говядина, зеленый салат, помидоры, маринованные огурцы, пажитник, кетчуп, майонез, соль, молотый душистый перец;Сэндвичи;Авторская кухня;https://eda.ru/recepty/sendvichi/steyk-burger-po-armyanski-114509
Стейк бургер по армянски;говядина, зеленый салат, помидоры, маринованные огурцы, пажитник, кетчуп, майонез, соль, молотый душистый перец;Сэндвичи;Авторская кухня;https://eda.ru/recepty/sendvichi/steyk-burger-po-armyanski-114509
